character,top sccs
扊,扊廀屡屪扆緳扅赓匧曝
手,手于子干千乎甼宁芧雫
扌,扌礻牜忄屮钅亅小少丨
才,才丆寸劾郂牙芽刻欬办
扎,扎札孔乩扑乱扯劜钆轧
扏,扏扤抭抌朹执扔拀机仇
扐,扐抌牞扨执朸扔忇扤挒
扑,扑朴扎钋圤卦补讣仆虲
扒,扒抓朳弧柧玐孤扖叭枛
打,打耓朾钉虰靪玎灯饤忊
扔,扔扨扐扏扤掤抌拀韧挒
払,払扖弘仏掞扒抷抔撚擌
扖,扖杁圦扒朲叺払枤魞擌
扗,扗扛挂牡扯杜抂拉社圱
托,托扥牦枆拕挓竓挊秅眊
扙,扙抆杖技粀忟扠枝投仗
扚,扚礿抝抅玓杓虳圴畃钓
扛,扛杠扗抂玒羾挜扣缸掽
扜,扜扞抙孖拧抒扦衧抂杽
扝,扝杇拧杛掃扜抒抙揚疞
扞,扞扜扦抙幵拝抂拧抒扭
扟,扟卂抓扒籸凧擫阠挪擜
扠,扠权杈抆衩技扱仅钗扙
扡,扡牠弛忚杝批抴祂虵他
扢,扢忔杚籺仡圪犵肐矻忾
扣,扣拁拍抽扪拈扛珈牭抑
扤,扤扏抌抭杌拁执扔扐扨
扥,扥托牦枆挓挊毮挠拕竓
扦,扦抙扞杄扜拧杽忏粁抃
执,执扐扏抌扤抭朹挒扰執
扨,扨朷扐挒初扔杒扤抌朸
扩,扩护圹犷拡旷拁枦矿扤
扪,扪抑拁捌掽扣刊恤珈川
扫,扫揊掲揎揖抯抇揈撋掴
扬,扬杨钖场掦畅玚炀饧肠
扭,扭抯攂掤揾掹挋抂拙杻
扮,扮枌衯玢拚抁挩坋帉羒
扯,扯拙杫址扎掽祉抴批扗
扰,扰抚拢抭抌捥抗抏扏执
扱,扱忣扳极圾昅披岋扠彶
扲,扲拎枔柃衿仱羚忴坅怜
扳,扳扱板披坂皈叛粄钣舨
扴,扴忦祄玠吤抁衸圿妎价
扵,扵於拎捻柃抡抮扲袊抢
扶,扶抶扷挟捒抹抰挗枎抉
扷,扷扶袄祅枖抶挟抰探仸
扸,扸掤拙拥揣撊抍棩抈捌
批,批玭枇蚍玼秕舭扯仳扎
扺,扺抵抿忯択挀拫怟振弤
扻,扻拻弞杴忺抶挾坎赥擌
扼,扼枙抳呃伌掘栀搄抛振
扽,扽杶忳抽拍捕拈抻抱抌
找,找牫我戕战伐栽栈戏拔
承,承氶氷水爪永穴斌八丞
技,技抆投枝扙拽扠披抜按
抁,抁扴挩拚狁玧吮忦馻扮
抂,抂挂扛捶挰拝扭捏扞掗
抃,抃忭拧扦玣扑拤捄扞抒
抄,抄杪挱耖粆妙钞炒竗吵
抅,抅抝构扚礿袀拗袧灼抣
抆,抆扙技忟扠挍拉坟拔杖
抇,抇摳拒抯撋揊捐撊掴捛
抈,抈抇撊拥挶捐拐扸挏抯
抉,抉抰挟玦抧扶抶挾挗块
把,把杷弝羓舥肥耙粑帊蚆
抋,抋杺伈吣恥沁拯牻抡扑
抌,抌扤扐捥抭扏忱执扰抚
抍,抍枡拼拚挮拂扸扔掜扦
抎,抎枟搨忶秐抾振擾揚揭
抏,抏拀抚抭抗忨杬捥扰坃
抐,抐抦捆衲枘挞摑抠拪掚
抑,抑扪拁揤捌枊柳挷仰杊
抒,抒杼扜拧孖抙忬扞杍伃
抓,抓孤扒弧柧枛挀坬狐軱
抔,抔抷杯怀坏钚妚伓炋挢
投,投技杸祋羖拨授扙軗殶
抖,抖枓钭料炓科紏蚪呌掛
抗,抗抭牨抏杭扰捖掟折捥
折,折拆析忻拞圻抗柝扏祈
抙,抙扦扜扞拧杽抒捋括捊
抚,抚扰抏抌拀怃捥扔抗疣
抛,抛拋拁捌挝搣珈拠扼搠
抜,抜拔拨菝韨技按掕烲柭
抝,抝抅扚拗拘构物挒掬拣
択,択搌抿振拫扺伬呎蚇粎
抟,抟传捜抜按擭拃接捿转
抠,抠怄枢捆柩挞眍抦驱伛
抡,抡抢捻伦轮捡枪抮论拎
抢,抢抡捡枪拾捻玱掄怆掩
抣,抣揈掏抅伨扚拘挴扫搉
护,护扩枦舮粐掂抉拁拼拍
报,报拫搬搌扳翍扱択抿披
抦,抦抐拪捆柄怲掚抠挞撊
抧,抧抰抉怾捰枳挟伿帜扶
抨,抨枰軯拝怦掸押抻坪捊
抩,抩捕拑撋搰描抻撊抽柟
抪,抪拵柨搉捬怖拓拊拰拍
披,披扳怶柀扱翄技玻帔坡
抬,抬孡拾捨怡搶掄枱掐珆
抭,抭扏抗扤捥抏抌拀扰执
抮,抮袗掺跈摻轸眕珍昣诊
抯,抯挋抇撋扭担撊掴描拒
抰,抰挟抉抧抶柍扶怏軮佒
抱,抱孢枹拘掏拖怉袍狍佨
抲,抲柯牱捌挏牁掆坷撊揤
抳,抳扼柅怩狔伲坭搌掘据
抴,抴枻怈拙扯玴朑拪伳梉
抵,抵扺弤柢牴坻胝眡袛祗
抶,抶扶挟柣怢抰扷扻祑捒
抷,抷柸怌抔伾秠狉蚽杯坯
抸,抸柉授姂泛砭眨疺挖贬
抹,抹拺抺扶捒搛探抶揀枺
抺,抺抹怽拺扶捒探抶眛跊
抻,抻捕捙押拑抽揷掉掸描
押,押挕拥抻撊拝撣揷攂捏
抽,抽拍拑描拈捕措抻掂柚
抾,抾扶抶怯搓拱抹扷珐抎
抿,抿拫扺揋択搌振怋恨掁
拀,拀抏掜抭柷捉抚扏扔怳
拁,拁珈捌枷抑扪扣扤伽拋
拂,拂挮排拼抍怫拚捞搛柫
拃,拃怍痄搾作秨祚挊拤炸
拄,拄拧柱挂扭祍掽拰掹掂
担,担掴撢抯撋捚挹拒捏揖
拆,拆折柝挀拞析忻搋坼抗
拇,拇揖搰撋捏挹担掴捚攂
拈,拈抽拍措描拑捕扣枮钻
拉,拉抆柆扗粒位竝扙垃拄
拊,拊弣柎祔袝胕軵驸坿扪
拋,拋抛拁挝拠捌珈恻拡帅
拌,拌柈怑靽袢掸秚挡伴坢
拍,拍抽拈拑扣掂描抇措捕
拎,拎扲柃玲怜铃伶袊枔羚
拏,拏孥挛挐掔孯挚驽孶摮
拐,拐揚枴柺捞掜挸掦抈捖
拑,拑描抽捕撊撋抻拍措抇
拒,拒摳抇揊挋担抯撋掴撞
拓,拓捃祏柘抇抪掿拒挥揊
拔,拔抜拨柭軷菝坺祓袚帗
拕,拕柁袉挓疕托铊花扢坨
拖,拖柂掏抱粚袘狏揔砤扢
拗,拗怮袎柪物軪靿抝坳蚴
拘,拘怐枸掏抱栒袧玽恂佝
拙,拙抴扯扸柮掤抯描扭抽
拚,拚拼抁抍挩扮扴拂捈挮
招,招捛摺弨搕玿柖捂怊捃
拜,拜宑竎穽畀舁拝彈肄详
拝,拝挥挵押捍扞抂抨擇捙
拞,拞折拆翋坵岴扯忻拰捳
拟,拟抄姒抑挱掝揤似捗揪
拠,拠挒拋杊恻桞扤栁籶抑
拡,拡昿砿扩拋抠挔鉱挞絋
拢,拢栊扰珑眬昽拔垅胧捗
拣,拣栋抹搛捒揼揀抉掬探
拤,拤挊桛抹佧裃疜抃拃扶
拥,拥捌掘掤押撊据挏挶抈
拦,拦栏撞摚撑犝撢搢攚挡
拧,拧抙扜拄柠疔扝抒羜扦
拨,拨抜拔捘袯掕投韨祓柭
择,择怿掻搔捀栙怪慅释佭
拪,拪牺栖抦撋插掴捆揂恓
拫,拫抿揋掁搌振掍恨択报
括,括插挿揷指捅措揗描栝
拭,拭恜掝栻擑轼珷撠臧试
拮,拮措擋掊捁捂攜掿描桔
拯,拯抷洆抠抔挔抋怺挾怌
拰,拰推栣袵捳括挋抪拄拞
拱,拱揲扶捵掑撲抶栱操擈
拲,拲辇拳挙季蓥秊輋莾茡
拳,拳牶鲞挙拲弮耊举巻韏
拴,拴牷栓恮捦輇挃拾撜辁
拵,拵抪搉栫袸珔侟柨榷怖
拶,拶桚拎拸捘扲抮栘摉柃
拷,拷栲捲搓侤铐擆掿楮搾
拸,拸栘恀袳侈垑跢眵摻拶
拹,拹栛協恊珕拚抁捬扮掤
拺,拺捒抹揀栜抺扶悚挾抶
拻,拻挾扻诙恢烣杴疢疚咴
拼,拼挮抍栟拚恲拂捝扦搛
拽,拽技拫捜捸搜栧披掑桹
拾,拾抬抢袷捨梒恰祫帢珨
拿,拿搻畣盒錱糞盫龛龕弇
挀,挀抓振眽脈拆扺掋哌孤
持,持特撐挂拧挦恃挬扜拝
挂,挂抂摚扗撶拄搓措捁描
挃,挃恎拴桎铚牷捀撜撪祬
挄,挄桄挑珖恍垙扏胱姯輄
挅,挅桗挆探跥搩抶躱捰棎
挆,挆探挅捰抺棎抶跺垛搩
指,指括揞搯搳掅栺措描掐
挈,挈望摯掣蒘朢鞤揅擎挚
按,按接桉抜技铵抆捜拔掕
挊,挊拤桛裃拃垰佧捸托抹
挋,挋抯捱撋摳据拒抇掘栕
挌,挌格恪袼揢珞垎撘路胳
挍,挍校恔珓晈烄抆佼皎饺
挎,挎恗桍咵晇拾捨舿掎捺
挏,挏掆摳撊拥掴抇捆捅恫
挐,挐蒘挛拏窯毠學罕孥孧
挑,挑桃恌珧祧佻铫挄狣眺
挒,挒栵扨桞初扐拠例冽揦
挓,挓拕扥托侘梍攙毮柁撑
挔,挔挾铱拻扻疢饻扖畩依
挕,挕押弭搑抻捙抲栮撋撣
挖,挖抸疙徔挧摻扢抮掺疹
挗,挗扶桋抉恞挟抶捒揀攘
挘,挘撈毮耮憦橯挨抁擽搊
挙,挙举牶拳拲学摮拏斈癷
挚,挚摰摯搫撆摮揫擎掔擊
挛,挛孪拏李羍挐孥挚薴孶
挜,挜掽桠垭铔扛扯掗拁椪
挝,挝抛捌拋抴擿挞拁扡撇
挞,挞抠抐跶扖挝抦鞑擌垯
挟,挟抰抶扶抉挾捒揀扷揬
挠,挠桡铙搐饶侥烧硗绕娆
挡,挡铛档摚拌裆捎珰垱拦
挢,挢桥掭侨折抔峤疥挤乔
挣,挣狰掙换摖擽擳撨掸挴
挤,挤脐侪拼芥哜跻挢搤疥
挥,挥拝捍挵撣揮撁挬掉擰
挦,挦桪撏捍摶揨棏擣撔持
挧,挧栩搦祤珝翃诩拕翓翔
挨,挨换揆携摷竢埃検挘摈
挩,挩抁悅梲脫拚扴扮捈玧
挪,挪捓梛挷揶掷捌哪琊拁
挫,挫趖唑侳睉挳悭锉脞摼
挬,挬捙撑桲揮掉揨摶撣捍
挭,挭梗掜捉捜挸搜捷提掼
挮,挮拼祶拂捝梯抍搛挽悌
振,振搌桭拫挀搧帪掁択侲
挰,挰捏擇捚揑揘捍抂揖桯
挱,挱桫抄猀唦耖麨紗拟杪
挲,挲毟孶孳毞鲨娑耄窰垒
挳,挳牼桱弳俓殌徑娙踁挫
挴,挴掏揈擕撸撨推梅捾悔
挵,挵拝撓挥梇擤捍揲擇捭
挶,挶据摀捐揙梮掮拥掘搗
挷,挷挪掷揶抑捓梛梆捌揤
挸,挸掜悓梘拀拐搝掼提垷
挹,挹揖邫担悒郌捐撋掲掴
挺,挺挻铤梃珽艇駳脠梴侹
挻,挻挺梴狿埏揵梃駳脠綖
挼,挼桵授接援捼鞖脮俀按
挽,挽梚换悗捝挮挩俛掜輓
挾,挾拻悏梜挟疢裌挔扻棶
挿,挿揷括插掃捅捕捶指抻
捀,捀桻栙择掻琒撪锋搔搖
捁,捁措拮牿描擋拑摕推捕
捂,捂揊擂措牾搳拮摴擩捃
捃,捃掿拓捂捛措桾括搓拮
捄,捄梂俅拺捸浗殏脙球抃
捅,捅揷摘掆括挏撊桶捕插
捆,捆悃掴挏掆抦祵抐拪棞
捇,捇扐抌抭扤扏扰捥硳抗
捈,捈梌悇搇捺稌艅俆畭馀
捉,捉提拀掘掤扭拥抳掜捷
捊,捊揺掙桴摇捋粰抙抨稃
捋,捋锊蛶捊抙脟将埒哷挼
捌,捌掤拁拥抑揦挪揤抛抲
捍,捍擤撔桿揨挰捏揘擇撣
捎,捎掯弰悄梢揹琑摘挡捔
捏,捏捚挰揑攂捍揘担捶挋
捐,捐掅掯挶抇梋捛搰掃挹
捑,捑搝犑捰悮摆操悞揲擙
捒,捒揀拺扶抹悚挟抶抺梀
捓,捓挪琊峫铘梛哪揶娜掷
捔,捔觕捎桷捅栬摘揂掆掐
捕,捕描拑抻揇抽摘措撊掯
捖,捖梡掜抗拐琓掟拼捥羦
捗,捗拢抄拔披挱拟扳踄埗
捘,捘梭拨悛埈稄羧掕竣拶
捙,捙掉撣掸抻挬揮捭撶搏
捚,捚捏挰担揑捶揘擝梩攂
捛,捛招捐抇梠椙捂掲搰揊
捜,捜搜授拽技按接捿锼挭
捝,捝棁挮掜挽悦搅拼帨锐
捞,捞拐揲撐拂搒挮揚撈搅
损,损掼挸埙拀搝擐顿搅殒
捠,捠梹摈掑撰捵擛娦捑捩
捡,捡检裣抢捦崄睑俭捻猃
换,换換挽挨摷唤搝焕捑捵
捣,捣拍抽擋措抩搊拈拙抯
捤,捤梶握挶搱摒搪据摨提
捥,捥椀抭抌扰惋抏埦抗执
捦,捦惍唫捡琻拴捻抢崯掵
捧,捧棒搸擡搼俸榛撁琫埲
捨,捨摿拾抬掄搶撦梒挎掩
捩,捩掶悷振睙擴搧挀唳椩
捪,捪搭搢揞揟棔撟搯揩惛
捫,捫椚搰撋撊把們掤抩捐
捬,捬椨掂抪揓摭腑俯拁搋
捭,捭椑捙掉掸抻撙搏撐粺
据,据掘捱挶搪挋拥掂摨椐
捯,捯椡擳抲倒揤揦剷拘劙
捰,捰操搮挆抧惈棵捑揲探
捱,捱据摨搪挋掘摳摌挶揗
捲,捲犈棬惓拷裷倦掕捧搤
捳,捳掹揾挋拰搞揊掘摳拞
捴,捴棇倊焧攨聡総揔捻抡
捵,捵掑椣拱擙棋撰璵琠猠
捶,捶揰掗捚揷撢捏抂擂拒
捷,捷提掟蓵揵攓拒捉搪擄
捸,捸棣拽捒拱様揲挊捄摞
捹,捹揜喯锛挎扴拚倴掩抁
捺,捺捈撩搇倷梌挎悇拣探
捻,捻惗抢捡抡捦撿稔拎棯
捼,捼搂攖掕摉捿援挼擭踒
捽,捽椊悴琗祽睟粹埣晬稡
捾,捾揎搞揊擕擋掅撸摣搳
捿,捿摟攮摱擭棲攫攖悽擾
掀,掀惞锨俽撇撅揪橛蹶擨
掁,掁張拫悵揋振棖揠倀粻
掂,掂搪据掘捬抽拑捱揗摭
掃,掃掅搞捐挿揙搹揊攝蒱
掄,掄掵揄棆惀耣椧掩捨撿
掅,掅掯捐捾攜撌蒱揟揎揞
掆,掆挏摘犅撊棡捅捆拥抲
掇,掇惙裰啜辍棳擞錣輟腏
授,授挼搜捜接援投技抸摂
掉,掉捙揨撣抻揮掸棹挬捍
掊,掊揞犃搐拮棓擋捾措擕
掋,掋挀摭疷摵抵扺揻疧抓
掌,掌黨堇葟享聿辠羣辜事
掍,掍拫棍搨搌惃抳裩揋提
掎,掎犄搕撟搐掩椅搤挎琦
掏,掏挴拘拖抱揈擕抣推抅
掐,掐抬惂指搢搘推摣摺搉
掑,掑捵棋摸拱褀椣捠祺撰
排,排拂棑琲悱捇腓輫抌扤
掓,掓婌椒踧琡埱諔撇搬摵
掔,掔孯鋻竪堅擊擎摮婜豎
掕,掕捘拨棱搂抜摉堎捼稜
掖,掖棭腋焲翄拔扳翍抜扱
掗,掗孲捶撢抂挜椏捚扭攂
掘,掘据拥捱掤挶掂挋摨捉
掙,掙捊揺摇棦掸拌擰揷挣
掚,掚撊掆抦捆抲裲拊拥挏
掛,掛褂擜抖啩擑批揤擳摲
掜,掜拀挸捖捝拐覒挭抍挮
掝,掝棫惐琙拭稢撠擻撖撴
掞,掞棪惔裧琰锬擌燅舕錟
掟,掟椗捷抗提捖琔埞啶搪
掠,掠弶惊椋孮攍悰捒琼辌
採,採棌啋倸婇踩埰睬挅扷
探,探挆挅棎抺抹捰搛扶搽
掣,掣揱揧挈望揅孠犎聖蒘
掤,掤扸捌拥撊掘拙棚扭扔
接,接按椄授挼摟搂捜帹援
掦,掦揚裼惕禓扬摥楊暢拐
控,控悾椌挂揑抂鞚搕拄搈
推,推搉拰擕撨惟掏捁椎掐
掩,掩掄抢撿掵揸捨掎拴拾
措,措拮擋描捁抽捕捂掯括
掫,掫撖棷娵诹撒踙橄陬擏
掬,掬椈拣抝抌捥挟扻抹婅
掭,掭悿舔挢婖探抔添搲捬
掮,掮揗揙搧挶槴搪擄搞捐
掯,掯掅捐捎揇措描捕擋揹
掰,掰斨新搿所剙澵椕辦卌
掱,掱毒孨冓蕁靑薵壽霱尋
掲,掲扫搗揖搰摀撸揭挶揊
掳,掳摣攄搋擄攎擴搪摅抈
掴,掴摳撋担抇抯摑挏椢捆
掵,掵掄椧揄棆扴惀掩抢撿
掶,掶捩椩棙擴悷挗振睙唳
掷,掷挷挪捓踯揦揤梛擲捌
掸,掸捙弹椫抻惮掉禅拌撶
掹,掹扭捳揾括搵擂搤拄搕
掺,掺摻椮犙抮惨糁毶槮摎
掻,掻搔择捀慅怪柽瑵搤搖
掼,掼损惯損槚愤挸掜愦擐
掽,掽挜椪扯扪踫拁碰拄諩
掾,掾瑑椽禒褖堟猭橡蝝喙
掿,掿搓捃擆撯拮措楉拓捛
揀,揀捒拺挟楝扶悚瑓抹梀
揁,揁搷摃損摸摜撗撌槙楨
揂,揂拪禉楢輶崷摘捔鞧偤
揃,揃瑐偂摲椾糋抲媊撤揥
揄,揄瑜掵掄愉榆羭睮牏偷
揅,揅蒘挈擘擎摯掣藝摰窶
揆,揆楑挨撲猤睽暌骙掞擈
揇,揇捕掯描撊楠摘拑擋搪
揈,揈挴掏揞撸擋扫捾抣擕
揉,揉搡楺搮摞孫搩糅槡摽
揊,揊擂摳搹搞拒搳捾抇揎
揋,揋拫椳愄掁抿搌揌擃恨
揌,揌摁愢楒摠搃揋腮锶偲
揍,揍搸榛攐痿楱搝辏擦凑
揎,揎撎捾撌擄揊撞摜楦掅
描,描拑抽捕措撋摘擋撊插
提,提捉捷惿掟揾挶据捤攂
揑,揑揘挰捏揾捚捍撑搗掲
插,插括揷描挿拪撋捅撊摘
揓,揓椸暆捬擨湤撇惞翑鍦
揔,揔楤惚愡牎偬聦惣唿騘
揕,揕擋捏摧描抩椹抽挋搑
揖,揖挹撌揎掲搑楫挶扫摜
揗,揗掮楯搪抇据括攎捐捱
揘,揘揑挰撑捏捍捚楻搗揨
揙,揙搱搧挶掮搪摨惼楄搹
揚,揚掦禓摥拐暢愓楊瑒偒
換,換换愌瑍擙搝搡喚揆揬
揜,揜掄捹鞥搶撿掵擒啽掩
揝,揝撘撍糌偺挌攚搭搢攢
揞,揞掊擋搢掅搯指捾搳措
揟,揟搢掅搰揹楈捐掯捪撋
揠,揠椻愝摳掁揭掴拒搹捱
握,握捤摨搱楃搪据挶捱喔
揢,揢楁挌搈愘摏萚搭擦搖
揣,揣椯惴揥扸踹耑端荋褍
揤,揤抑楖捌揦掤抲掷拁挪
揥,揥揣楴禘捕摘摕拧揇搤
揦,揦楋捌揤挒掷抑捓拁扪
揧,揧掣揱堲蒘犁挈型聖犎
揨,揨摶楟犉捍擣掉撑椁擤
揩,揩揹搘楷摺措搢指捪揸
揪,揪楸愀锹瞅偢踿煍搣啾
揫,揫媝撆挚蝵鹙摮鍫擎摰
揬,揬堗挟摤搽扶抶抰抉挗
揭,揭掲搹楬揠擱捛愒掦揊
揮,揮撢撣撞擤捙揎捍掉擇
揯,揯搄摳撊掴揗撋抇拑摘
揰,揰捶撞揮撢擅犝瘽瘇擡
揱,揱掣揧堲挈聖里壨望摯
揲,揲擛拱擈捰操楪搮捒弽
揳,揳楔擙擽偰撲撰喫瘈禊
援,援楥瑗愋禐瑷授嫒挼褑
揵,揵挻犍楗捷撻摙挺提搥
揶,揶椰挪挷捓鄒邽邴倻郮
揷,揷挿插括捅捶捕抻押撊
揸,揸撜楂掩搘拾拴捨揩猹
揹,揹揩搘措禙捎掯搆揟偝
揺,揺摇搯捊掙搔播搢揞搖
揻,揻搣摵楲槭椷慽媙羬磩
揼,揼捰拣搮捒探挅揀掠挗
揽,揽榄搅抁挽捝挄撈摷摾
揾,揾搵榅揑愠扭抯掲掹韫
揿,揿撳撽摗撴擞掀擏擹撒
搀,搀換攥攐换谗拸犪拷捘
搁,搁擱捆摘掆招拥撍撊楹
搂,搂捼楼褛耧掕摉接撲援
搃,搃揌摁摠攄搛聪撝搌摛
搄,搄摳揯暅掴拒恛抇腘扼
搅,搅撹捝摬揽捞损挮摚挄
搆,搆攜掅揹蒱搚措掯擣揟
搇,搇捈捺撿梌悇撡捻捦俆
搈,搈榕愹搭撘摉瑢穃揢褣
搉,搉推拵榷摧抪栫掐傕恠
搊,搊犓攙挘捣掲招掏撈擉
搋,搋禠榹掳褫拆蹏振螔挀
搌,搌振拫択揋抿榐抳掁挀
損,損摜撌摃搷擤揁撔撗擯
搎,搎槂猻喺緜緐縣繇挤鯀
搏,搏摶捙撏掉摢撙捭擰搙
搐,搐槒搘掊慉搖搕掎摛稸
搑,搑揖撗挕撢撹撌撐摚描
搒,搒榜捞摬挮搓拼提撈抈
搓,搓掿槎挂抾捃拷挮撐搒
搔,搔掻慅择怪捀瑵柽糔揺
搕,搕榼摏掎搤搐搭招撟拮
搖,搖榣愮搐捀擢瑤摿揺揢
搗,搗摀搞掲擕挶攜揘撎揎
搘,搘搐揹搢搚榰愭揩掅擔
搙,搙槈摶撏搏搱揮褥摨挥
搚,搚愶搘撍擢搢摺擼揝揹
搛,搛抹挮探捒槏拣抺拼扶
搜,搜捜授弢技艘拽投披揋
搝,搝摸捑犑擤摈擙損糗揁
搞,搞揊捾犒搹槁搗擕擋掅
搟,搟摲揷擩捕押摕玂拑抩
搠,搠扐捌摫掤扔拀拂抛嗍
搡,搡揉槡摞褬換楺揆磉揳
搢,搢揞揟搘榗搯掅撸搚捪
搣,搣揻摵槭楲揪羬掀慽掓
搤,搤艗镒榏益搕膉掎谥螠
搥,搥撾槌擿摙撻搓塠捷翴
搦,搦搨挧榒糑愵捸祤褟栩
搧,搧揙振掮攄挶捩搱搋搌
搨,搨榻搦揚禢褟抎掦擾掍
搩,搩榤擽挅傑搽挆探樑抶
搪,搪攎揗捱据攄摣揙掂摨
搫,搫擊撃擎挚瑿摰摮撆媻
搬,搬棴赧掓撇报摋掀赮擨
搭,搭撘榙搈捪揝搕摏褡揢
搮,搮操捰摽擛揲慄揉揼抧
搯,搯揺慆揞搢擢摇摺槄指
搰,搰撋捐掲榾捫揟掅愲揖
搱,搱摨揙摒握搪捤据捱挶
搲,搲箛菰抓掀扒擨搬挀扴
搳,搳揊攜捾捂掅揞撸掊搞
搴,搴鑍藆謇骞鐾辈塞奉耊
搵,搵揾榲慍膃掹搕榅招弨
搶,搶愴槍牄瑲摿抬傖捨拾
搷,搷揁摃損槙慎摜瑱蹎瘨
搸,搸揍榛捧楱擦搼攐摈瑧
搹,搹揊搞槅掅揙擂捾掃揭
携,携挨擕撨撈槜摀撹摸摬
搻,搻拿錱弇畣盒禽鑫龛樖
搼,搼捧搸痵揍摔榉撪撁择
搽,搽搩揬探挆摤攃掞蒣摖
搾,搾榨拃撁撵挥攞摔拷控
搿,搿掰擶癤羺癰旖斴新羭
摀,摀搗挶掲擕搞攜撔鳱撎
摁,摁摠揌搃煾楒抧愢牕把
摂,摂擐摄擾攐攘技畏揋挗
摃,摃撌摜損搷揁愩撗槓嵿
摄,摄慑摂蹑嗫镊摽撔挦捜
摅,摅攄掳摢櫖據摣搋摠疕
摆,摆捑擇操擐撔挰搨犑捰
摇,摇揺搯掙播捊擢谣瑶搖
摈,摈槟捠镔搝摸掑揁搸搷
摉,摉搈摻掺掕搂拸捼犙擦
摊,摊傩撱滩瘫齚捬舴擁抪
摋,摋樧榝掓搬鎩揪掇婌椒
摌,摌摨捱擔擓搪擄摓攎撻
摍,摍樎捾抇揊擕搞掃推摳
摎,摎憀樛僇嘐镠穋蹘熮谬
摏,摏樁搕蹖瘩揢搭搈瘠痞
摐,摐樅瑽傱蹤嵷暰豵瞛磫
摑,摑掴槶慖捆幗抐掆拪攌
摒,摒摨搱幈捤据捱搪掘握
摓,摓槰塳撻熢膖摌韼掻擬
摔,摔捽撁繂擦悴攃搾撵挳
摕,摕捁捕拑拮揥措蒱僀嵽
摖,摖憏攃擦傺穄擽際櫒漈
摗,摗樕撽嫰嗽嫩揿擹敶躈
摘,摘掆撊捕描捅撋拑捎插
摙,摙撻慩槤擿橽櫣撾搥褳
摚,摚撞挂樘拦犝挡憆搑撢
摛,摛樆搞搐撸褵掊撟摠搹
摜,摜撌損摃揎擯搷撗揁樌
摝,摝樚摭搪抻揥攠掂攦擴
摞,摞樏揉搡镙捸攐摽蓀撂
摟,摟捿摱擭攮撎損擾接褸
摠,摠摁樬憁牕揌搃幒熜傯
摡,摡慨概穊嘅槪摫溉搠厩
摢,摢搏攎攄嘑搱嫭掳摅擵
摣,摣掳捾擄攎搪抇攄擔揎
摤,摤慡樉傸磢塽揬挾悏漺
摥,摥揚慯掦塲禓傷痬殤膓
摦,摦槬擏瓡瓠瓢挪抓觚制
摧,摧搉槯蓷慛挋捛描捱摳
摨,摨搱捱摒摌揙搪据樨握
摩,摩麾犘麿黂厪廑靡塺磨
摪,摪蹡擸拹樇扡兠抁搃摠
摫,摫槻搠捉拀摡掤掜櫬瞡
摬,摬撹撗樈摃撌損搅摜搷
摭,摭樜攄掂摝墌捬搪蟅犥
摮,摮擊擎撉撃孶摰撀掔辇
摯,摯摰謺挚挈撉擊擎撃藝
摰,摰摯挚撉擎摮擊篫搫謺
摱,摱摟擾慢捿槾損幔擭镘
摲,摲慚搟嶃玂撕揃螹擜撷
摳,摳揊拒掴抇挏挋搄樞撋
摴,摴樗撸撢攉擩捂蘀擅揊
摵,摵揻槭搣慽磩嘁悈械墄
摶,摶揨搏撏挦撑捍搙挬擤
摷,摷樔轈璅擽换擈挨鏁繅
摸,摸搝撲模揁掑摈搷撗糢
摹,摹蓦墓臺蟇繤募謩藆辜
摺,摺擢槢搯揩招搢捛慴搚
摻,摻犙掺抮慘槮襂幓摎墋
摼,摼樫慳捚挫挳擝攑擵櫭
摽,摽搮擃擛撔標慓操摴揨
摾,摾膙襁抬扡糨揽擳擀擿
摿,摿捨搶擒抬檜攚撦懀襘
撀,撀擊孽撃擥摮薴罄謦韾
撁,撁擰撶攉捀挥揮搾攆撵
撂,撂摞擇擆掲躩露攫摆畧
撃,撃擊撉摮瑿搫擎罊撀摯
撄,撄攖樱孾揳嘤缨搜抄璎
撅,撅噘蹶瘚橛掀嶥獗镢擨
撆,撆氅擎挚揫摮搫彆摰撃
撇,撇襒掀撒獙徶僘掓擏惞
撈,撈挘橯憦耮僗携捞軂擽
撉,撉墪擊撃摮鐜摰摯擎墍
撊,撊撋拑摘拥挏掆抇掤描
撋,撋撊抯搰抇掴拑挋描擱
撌,撌摜摃損撗揎掅揖撎擄
撍,撍憯橬揝搚搢糣櫭捪攢
撎,撎揎擡擅撌掅揊擣搞攜
撏,撏憳樳摶挦搏搙襑噚攇
撐,撐撑持捞揲挬撙搑摶捭
撑,撑揘揨挬撶撐拦摴蘀摶
撒,撒撤擏撖撽橵撴撇撠橄
撓,撓挵攙拝橈捿憢攈挂擛
撔,撔捍擤損摽憬揨摀摆搗
撕,撕嘶摲燍蟖凘澌斯靳斮
撖,撖掫撒撴橄擏撽犜瞰棷
撗,撗撌摃損摬摜揁彉撹摸
撘,撘搭揝搈挌榙褡裕譗捪
撙,撙樽搏撑捙撐捭掉罇挬
撚,撚橪燃蹨繎嘫挞沝林牀
撛,撛橉辚憐璘搂拼僯燐轔
撜,撜憕揸橙拴璒竳墱拾蹬
撝,撝攄掳摀鵝摭搗擕搧蟡
撞,撞犝摚揮揎撢揰橦擡拦
撟,撟犞橋憍掎捂捪搕擩搢
撠,撠擑擮橶擜撒攕撤掝旘
撡,撡摻攨搇拸捈捴犙搽捄
撢,撢揮担撣撞摴橝捶揰擇
撣,撣揮捙樿撢捍彈掉擇擤
撤,撤撒擏撴瞮橵撠擮徹撖
撥,撥橃襏蹳捘擸墢撜撿扲
撦,撦捨擆摿搈挎擒搐搘搖
撧,撧攞挻拖揔摐挣濰挺捯
撨,撨推樵撫擕携挴憔榫僬
撩,撩憭捺璙橑瞭嘹镣掩挎
撪,撪攆捀楏拴撺揸睳挎檋
撫,撫憮橅撨幠璑嘸抱抅挴
撬,撬橇膬鬔鬛鬢髢鬡髼鬠
播,播憣摇僠蹯皤燔噃揺搭
撮,撮樶嘬穝撔襊搨蹋熶搗
撯,撯擆掿攜揞掅擋擖拮撎
撰,撰擛捠掑攮撲捵操揳攘
撱,撱憜橢椭嫷摊樇揯揗搾
撲,撲擈摸樸擛拱揆揲檏撰
撳,撳揿擞擻撒歔攕撴櫢撽
撴,撴犜憞撽撖撒擻橔蹾驐
撵,撵攆犛挳捀搾撁樥撪挃
撶,撶捙挂撑掸撁蘀擇揮擰
撷,撷颧擏颛擷撒颟颥撖摲
撸,撸捾橹擔摴擋掲揊搞搳
撹,撹摬搅撗摜揁撌摸搑摚
撺,撺擒撪掩擂搐攆捨搖拴
撻,撻摙橽櫣槤慩摓躂擿揵
撼,撼憾僽摵轗揻鱤搣慼澸
撽,撽撒憿摗撴躈檄撖獥擹
撾,撾擿檛搥摙捌捉膼拥挝
撿,撿檢憸襝掄儉獫捻掩掵
擀,擀檊攤拌摲摾擗搟摕澣
擁,擁臃攞噰癕瘫捥摊挢捬
擂,擂揊捂擩搞抇搹摳捶撋
擃,擃摽憹檂擴損揋撔擔摸
擄,擄擴揎摣撌掅掮攎搪攄
擅,擅憻檀撎揎氊膻嬗犢擡
擆,擆掿撯撦躇搘撍搚蕏拷
擇,擇挰捍懌撣揮摆撢捏捚
擈,擈撲擛檏揲擽摷拱摸操
擉,擉攂抂挿揟撊捯插揖擇
擊,擊撃撉摮撀擎罊搫瑿摯
擋,擋措拮捾揞描撸搞掊攜
擌,擌掞扻拻挾找扖皳挞扱
操,操捰搮橾揲擛捑摆懆拱
擎,擎摮擊撃撆撉摯氅摰掔
擏,擏撒撤撖璥儆撇橄曔揿
擐,擐彋檈攘懁摂摆镮攌撔
擑,擑撠檝擮攕橶擜懴拭掝
擒,擒摿噙揄檎捻撺掄捨撦
擓,擓摌揯捱攊搪摧摳搄掂
擔,擔憺撸檐摌摣襜擄捾搘
擕,擕捾搞搗摀推攜擋掊掏
擖,擖攜撯攌搞撎嶱藒擡摥
擗,擗攠噼擵檘摝戂癖搱摢
擘,擘璧孽孹壁孼擥茟單睾
擙,擙懊捵揳搝換扠捑掑换
據,據懅璩壉摅躆槺臄噱痎
擛,擛擈揲搮摽撰撲操摸掑
擜,擜撠擮谳擑擨撒幟旘囐
擝,擝捚擂抯扭掗拙捛搵攂
擞,擞擻撴揿擹撳撽掇摗数
擟,擟檷彌襧獮穪儞禰攛擱
擠,擠櫅懠穧儕璾癠艩嚌臍
擡,擡檯懛撎撞揎瘽瘴擅捧
擢,擢摺搯搚櫂摇搘搖搢糶
擣,擣懤揨攜檮撎攇掃擩擡
擤,擤捍損撔揮撌搝揨撣襣
擥,擥孽朢譼撀蕇擘琧蕓擊
擦,擦攃瘵檫摖櫒攐搸摉揢
擧,擧搴譽舉鑍轝琴鸒弿罌
擨,擨惞擫掀撅擜懨撽撇摵
擩,擩孺擂摴搞捂襦攜擣揊
擪,擪黶饜厴壓壂掔嬮擊匩
擫,擫懨嚈擨痲擜掘揻摵摑
擬,擬懝摓礙儗掇譺擌挨撥
擭,擭檴摟捿耯攫韄撌摱愯
擮,擮撠擑擜撤撒擏橶摵掝
擯,擯檳摜撌損攅獱摃攢穦
擰,擰懧檸撁撣擇攆撶搏揮
擱,擱撋櫊攔撊揭揇搁抇攟
擲,擲躑掷捯揶側挷踋踯惻
擳,擳擶櫛捯幯摲揃揄櫤掛
擴,擴擄搪捩攈掮摜掶擔擃
擵,擵攠摢嚤擗摌攈攊擠摼
擶,擶擳櫤揄揥掵撤掄橁攕
擷,擷攧撷攏襭攦攋掼攂掙
擸,擸犣獵攛摪儠臘躐撥摷
擹,擹撽僛躈皦擻摗曒揿擞
擺,擺犤襬掍攦摞攭擇攞攙
擻,擻撴櫢擞撽撒擹撖驐犜
擼,擼撸搚掲櫓攉揎攙揊捔
擽,擽櫟搩爍瓅擈皪躒摷揳
擾,擾櫌摱耰懮摂搨捿摟攮
擿,擿撾摙樋撻搥翴挝檛慩
攀,攀礬蠜鋆鐢鎜鐆鐅鎣鍪
攁,攁懩摏礢搸搂攓搈捼摉
攂,攂捏扭抯掤撊捚据押挋
攃,攃擦摖櫒檫瘵憏搽搩摉
攄,攄攎搪掳摣櫖摅擄摭搧
攅,攅攢櫕攆擯摜撌儧攚攬
攆,攆撵撪攅捀犛擰撁釐攚
攇,攇擣撎搳攍撏掃癋揙痗
攈,攈攗擴癑搷瘨癝摃癏癛
攉,攉摴撁捶揊癨攫撢擂癯
攊,攊櫪儮嚦壢瓑爏礰轣摌
攋,攋櫴懶瓎獺嬾襰擷揋摗
攌,攌擐攔摑攂揖擖挹揭撋
攍,攍掠搧揙攇搞捩癙搹揨
攎,攎搪攄摣櫨揗擄掮揙摳
攏,攏襱儱擷徿矓嚨攦櫳攆
攐,攐攘攥犦摂揍擦搸櫀懪
攑,攑櫸欅襷摼撁搼捧摞撂
攒,攒攢躜擽臜揳攃瓒搂撈
攓,攓捷攐擡摏提捧撁撯攁
攔,攔擱撊撋攌攦揇抦捐掯
攕,攕懺擑櫼撠襳鑯懴撳擮
攖,攖撄孾捼捿櫻摟樱攮撰
攗,攗攈癳擴癑癏瘰痕攦癡
攘,攘攐攮擐挗禳摂撰欜穰
攙,攙欃搊撓摟擤捿搖擯撔
攚,攚櫿揝巆搢摿攅攢搶搚
攛,攛擸擟揋摠报攄撿攔攨
攜,攜掅擣搳拮搗擋搆擕撎
攝,攝欇掃攂懾捍撔搨擇掍
攞,攞欏攭玀儸搾擁抔挥囉
攟,攟搪擱擴撋揞揠攎握揗
攠,攠擗戂擵撶攦抨摝捶癣
攡,攡囄摲揃擳攤搟掽揥揓
攢,攢攅欑攬摜躦揝攚儹擯
攣,攣孿鑾孌彎卛蠻篫犫孶
攤,攤癱擀揵攡撕擳攧搠儺
攥,攥攐櫀搸獆瘆擖撔槔摞
攦,攦欐攠攗擷攔摝襹摢攏
攧,攧擷癲顮顴顱撷攤攋櫇
攨,攨捴撡棇倊揔焧擸総摋
攩,攩欓戃矘曭儻捙撶摸擰
攪,攪攬撌損摬攅摜攚欖摃
攫,攫戄欔彏捿玃攮擭矡攉
攬,攬欖攢攪摜摃撌攅欑懫
攭,攭欚搈攞摉挃撘揢攃搭
攮,攮欜攘捿摟攫撰擾癳馕
支,支艾芆芠丈女叓吏羑文
