character,top sccs
皔,皔睅晘哻駻睤瞗噑睲喤
皕,皕昍甛臦瞷師葩瞄瞃瓸
皖,皖睆晥唍垸琓暁脘唴院
皗,皗睭晭瞷賙瞯碉喎眀啁
皘,皘崝腈晴睛啨輤喟碃唁
皙,皙晳晢蜤哲暂膂贙蜇諬
皚,皚暟嵦螘磑瞶皑靧皟鞼
皛,皛圼瞐辠晶畠贔臯皇矗
皜,皜碻唁髇嗃嵪瞎皘疇醕
皝,皝靗珖駫輄觥銧凯胱珧
皞,皞暤皡暭皥嗥嘷曍噑睅
皟,皟瞔瞶賾嘳嘖嗊靧幘嘪
皠,皠嗺嶉畦膗蓶磪皓罐璀
皡,皡暭皥嘷皞曍噑暤唣槹
皢,皢曉嶢嘵蹺膮僥驍磽嚋
皣,皣瞱曄哶嘩嘽咩鞾啈暺
皤,皤噃蹯憣幡磻鱕膰轓嶓
皥,皥嘷曍皡暭唣皞噑暤嗥
皦,皦曒噭憿嗷躈噋憞礉暾
皧,皧瞹曖懓暖噯暧嗳喛嵈
皨,皨呈圼皇曇嘦辠壘瞐鞷
皩,皩覲鶃旣鵿髜覬誽覭誢
皪,皪嚛礫瓅躒爍擽纅櫟轢
皫,皫嗻臕巗曞釃爊巁嚥礹
皬,皬矐曤矔嚯嚾臛礭疅虇
皭,皭嚼釂崢嶾嵈嵭爝睜爵
皮,皮庋度汥廄反庱廋痩瘦
皯,皯奸馯皹飦爿姧卙妍开
皰,皰炮齙麭炧胞龅饱鼩蚫
皱,皱鲏鮍皵鞁皶骳皷级破
皲,皲鞁皸斀駊臹跛鼔骳皶
皳,皳救耚披秛翍翄毅技皴
皴,皴麬绒级笯皳鈹敥狓狨
皵,皵骳鞁敲皼敁敮皶皷菣
皶,皶皷皵皾鲏皼鼓鼔皻皽
皷,皷皼皾鼓鼔皶皽皵韍敱
皸,皸皾皼皽皻皲鞁軑戰韍
皹,皹賱燀煇媈殫嬋齳鯶贉
皺,皺皸钺鮁龯铖绒锹羢緻
皻,皻皽皼瞂皶皸戱皾斀酨
皼,皼皾皽皷鼓敼鼔酨韍皵
皽,皽皼皾敼皷皻颤皸皶歖
皾,皾皼皽皷鼓鼔敼敲皸皶
皿,皿血叿屸吅卹哑咖虹山
盀,盀杢监泴仐楍盃十仚佱
盁,盁盈召盌盆空蕴盋叴盎
盂,盂孟霝击壺壸霊壼帝壶
盃,盃楍盉歪杢盇否窬唜蟸
盄,盄鼉壺壼噐衋罜蛗嚚噩
盅,盅岀圌腽旵昷膃出蛊茁
盆,盆岔蚠瓫坌湓盗帟盁谷
盇,盇夳杢益盉圶楍泴杏盜
盈,盈盁朁盔蝅盋罶盌盓峦
盉,盉岙盇盃香禿秃益杢呑
益,益盇盉搤杢泴奤楍盜盍
盋,盋名盔巠茖錅鍪螫垄菑
盌,盌帤嗧鵅盁盔銐召嚮绍
盍,盍韏蓋室葢荃荎盖盏誊
盎,盎葢吞岙蓋容銎轝崟器
盏,盏盞蚃耋蓍耆蓄盍耊蓞
盐,盐扑泴扎啙訃謐盀茁卦
监,监監豓盢盀膃崆牊蓝腔
盒,盒畣弇禽拿貪倉貟搻會
盓,盓瑬盪汪葐盈蛋璗盘蜑
盔,盔銮盗盜盋巠螫帑盚菑
盕,盕盌錃贇鋫埿瑬鎏盋盈
盖,盖誩壷壸盙蘦衁譸盍諻
盗,盗盜咨垐盔谷盇洛浴銮
盘,盘矗皛鼌咠晕暈畠量圍
盙,盙夁壺壼壷畗蘦靁亩葷
盚,盚坔銮茎荃垄畨鐜盏盔
盛,盛啓啔埾骼輅晵堅盩嶅
盜,盜盗垐咨盇盔銮餈益洛
盝,盝盠崈審蠡蓋坖鐾萫莕
盞,盞盏鬐蓍蚃鬢蟚耋鬡鬔
盟,盟琞昍眧曌盥田盄閏朢
盠,盠蠡盝嶳葢崈埊荃銎舝
盡,盡蓋蠆萾藎臺寚畫轟賮
盢,盢監濌监豓蠈腔踏骼坠
監,監盢监藍骼盩鴼轚豎駱
盤,盤幋螌搫鎜罄壂磐鏧罊
盥,盥睉盟脞矅昍鹽鬸骝堲
盦,盦盫竃畣軬盒龕拿宔鸶
盧,盧膚虘虗蘆宧鬳窟慮唐
盨,盨頾嬃窒罋墾媭鎏鋈澃
盩,盩盭整墪螯嶅嗸蟼骜螫
盪,盪璗蘯塣盓燙渇濭盈濐
盫,盫盦童竃拿箽量畣三蕫
盬,盬蘁噐體畱盟髇噩寷骷
盭,盭盩螸諮墪嶅誙螯蟼簵
目,目日吕且冒咠冝旦昌呂
盯,盯叮耵町酊肛耻可帄矴
盰,盰旰盱旴吁骭肝骬矸弙
盱,盱旴盰旰吁骬肝弙骭吇
盲,盲肓膏亶胄夁萺壹萱荁
盳,盳甿旷工舵眐暅盹矿眶
直,直百苴营萺苜萱亶亘葺
盵,盵肐吃趷矻阣扢屹忔訖
盶,盶貦玩酛朊岏呒呪坃蚖
盷,盷畇昀呁旳哅蚐昒眗眴
相,相桕梠楣椙桘栢棝柜梋
盹,盹旽肫吨晡砘葩眒瞄晌
盺,盺昕听肵岓斨馸跅斫肮
盻,盻肹盼眙昐哈晇肦吟朌
盼,盼昐肦朌聁吩玢帉岎砏
盽,盽眻咩瞱羘肨啈曄哶晆
盾,盾后唐肩眉廬扃貭扈巵
盿,盿旼呅馼呚砇畋玟魰哎
眀,眀明眖睭皗晭聣腉覸覗
省,省篬台鲨昝笞雀合營耸
眂,眂眡舐眽呧眠胝脈貾砥
眃,眃耺呍眎呩腺瞩坛騡妘
眄,眄吗瞷眲瞤瞯聑唒呵喎
眅,眅昄皈畈坂販岅版阪昅
眆,眆昉肪明眈眀舫劰胏肋
眇,眇吵砂唦訬尠抄玅魦粆
眈,眈耽叻胁骩帎觇肍酖馾
眉,眉后屇届層肩扄盾瘴痯
眊,眊吒厇馲竓牦枆酕毦矺
看,看宥峟春君肴着孴青宕
県,県呉異噪黒枼嘄嗥具厡
眍,眍驱呕駆岖睏抠肭怄胭
眎,眎呩眃际咊盶呍脉脲眛
眏,眏映胦咉吷駚岟軮駃眣
眐,眐聇旺眶臦叿咂肛耻瞘
眑,眑聈昒呦靿肳軪岰吻黝
眒,眒胂晡聃肿瞯呻畘眲脯
眓,眓晠怴戙皒聀睋成戨吠
眔,眔衆罘累禾冡罖泰芣乘
眕,眕昣跈聄胗畛珍抮轸駗
眖,眖呪晲睨眀明睍貺聣唲
眗,眗昫眴呴胊朐咰晌哅驹
眘,眘昚脊誊奆夻詧蒼昋脀
眙,眙咍胎跲骀跆哈肹腀蹌
眚,眚音青告置箐胄菁窅肯
眛,眛昩昧眜味皌呋咮跊睐
眜,眜昩皌眛昧跊呋味踈暕
眝,眝咛盱詝旴骬吇貯吁睆
眞,眞貫具廪真冥蓂廩貝質
真,真寘頁貞蓂蒖貢亘冥窴
眠,眠呡眼珉眂氓眡蹍珢呎
眡,眡胝呧眂弤貾砥眠坻骶
眢,眢詧鸳窅聟智胥鴛眚瞖
眣,眣昳胅呹畉眏呋映矤镻
眤,眤昵呢胒跜呃眼睼蚭屔
眥,眥皆貲呰訾觜歶鴜蒈暂
眦,眦皉骴跐毗呲玼玭砒旪
眧,眧昭牊駋鼦岹弨盟玿瞷
眨,眨貶砭贬砨抸姂呝飂軶
眩,眩昡胘呟舷弦玹蚿胲肱
眪,眪昞唡睏咽脼呐晒胭眍
眫,眫畔跘胖牉靽眻羘踃盽
眬,眬昽咙珑胧拢眈陇垅肬
眭,眭晆哇畦甠睦旺瞠胿跬
眮,眮晍哃瞯瞷晌睭胴呞晭
眯,眯脒咪炚瞇晄咊吙吠詸
眰,眰晊跮胵駤咥峌誈瞪睳
眱,眱咦跠恞暕胰峓暎戻暯
眲,眲咡聑弭呷眒胛瞤眄瞷
眳,眳略賂胳脗骼骆峈硌眵
眴,眴眗昫呴咰晌哬哅胊朐
眵,眵跢哆陊拸蛥誃昸恀栘
眶,眶瞘昛膒暅嘔腒醧睚膅
眷,眷巻弮觠誊吞昋鲞誉着
眸,眸哞黭眙晖睁矃晔瞈肸
眹,眹联朕畉咲眣映胅昳駚
眺,眺晀咷珧朓脁聎跳罀駣
眻,眻咩羘盽啴眫瞱牂弾群
眼,眼眠哏珢硍跟朖駺脹腲
眽,眽脈哌眂畖呱挀弧衇胍
眾,眾臮潀殒冦罧示炭叝寇
眿,眿昹咏脉栐睞怺詠阥賕
着,着善羞吉咅萶春眷曽言
睁,睁眸晔唤哗吽睢聯瞧睜
睂,睂肴仺奮合台雤觷詧臽
睃,睃畯脧朘晙骏踆唆賐峻
睄,睄哨弰琑艄硝陗踃帩峭
睅,睅晘哻皔噑睲駻暉唕睴
睆,睆晥皖唍琓暁脘睨垸晲
睇,睇骿胏聠昲賆胼皏駾脱
睈,睈睲脭鞓暒曎旺珵哩睅
睉,睉脞唑挫脛趖盥晔瞛哗
睊,睊睸晿瞶唱賵弲腭膭喟
睋,睋皒珴哦峨硪戨戙蛾聀
睌,睌晚晩脕悗堍鮸唤輓脫
睍,睍晛哯眖晲覑睨呪眀唲
睎,睎晞脪唏琋餙鯑崤稀眸
睏,睏咽胭眪昞碅眮硱肭眍
睐,睐蔝睞唻暕眛昧崃眜昩
睑,睑脸验崄硷险呛捡检玱
睒,睒晱啖腅舕醈賧琰赕埮
睓,睓晪唺賟琠晎璵哄踑腆
睔,睔踚睮腀惀碖崘瑜埨稐
睕,睕晼啘踠琬碗畹眈腕埦
睖,睖踜睃碐棱堎畯唛崚唆
睗,睗晹暘舓腸畼踢賜啺赐
睘,睘寰瞏裊裛袁蔉衰蓑霥
睙,睙唳蜧捩悷眅昈昄瞁掶
睚,睚啀瞊腒矋曞膅瞃啹眶
睛,睛晴啨皘腈矒啃唁晡喟
睜,睜踭琤哹崢眻靜碀眫諍
睝,睝鯬鵹瞀瞥諬督鹜骛鳖
睞,睞唻琜唊崍騋吙炚睐峽
睟,睟晬啐賥脺琗崪捽碎踤
睠,睠啳踡腃惓犈媵棬膡幐
睡,睡旺唾厜眶腄眐臣眭晆
睢,睢脽雎唯踓骓碓眶雃琟
督,督瞥唘瞀瞖膂贅譥鹙習
睤,睤腗皔踝眖腂眀髁睨膘
睥,睥髀脾聛眒啤眲琕盽呻
睦,睦踛晆眭矔畦胿躣塍睰
睧,睧琘崏碈矒瞊瑉睶惛諙
睨,睨晲眖聣唲腉晛眀睆睍
睩,睩琭醁碌騄腞鵦瑑喙娽
睪,睪睾罣罜峷宰嚚崋噐茥
睫,睫啑嚏嚔駏崨匪矖唗踕
睬,睬踩啋採埰睐蔝婇炚眹
睭,睭晭皗瞷瞯啁眮喎眀碉
睮,睮瑜睔喻踰牏崳羭騟揄
睯,睯暋瞖譥暬聱暓瞽瞀骜
睰,睰喏蹃躇暛睹啱髊蹉矔
睱,睱暇瑕腵騢嘏腶毆瑖矙
睲,睲暒睈睅喤晘瑆蹕睴睼
睳,睳喹蹅喳晻唵楏唫眙瞈
睴,睴暉喗暺瞫暐曋腪瞳嘽
睵,睵賳職驖膱戰韯戢戥懴
睶,睶暙踳瑃蹖賰堾璿晴膡
睷,睷踺腱騝鰎键躂脡蹥旔
睸,睸睊瞃啹腒矋瞊瑂跼睚
睹,睹暏啫賭醏踷膡睰帾蝫
睺,睺喉堠帿瞧胅眠糇睢咿
睻,睻暄喧瞔瞦賾瑄晅曀瞳
睼,睼踶哫睲騠瑅眤碮睸啹
睽,睽聧暌骙騤揆睒聫藈楑
睾,睾睪罣罜辠嚚峷宰茥琧
睿,睿誊舂容昋吞蓄春謇萫
瞀,瞀骛聱鹜贅暓譥瞥謷誉
瞁,瞁暝嗅瞑唄瞙暞脵嘄矂
瞂,瞂敮皻敺啟歐歃韍敽皸
瞃,瞃腯踲睸瞊聒睚甛矋脜
瞄,瞄晡喵咕暔眒瞷腊咁畦
瞅,瞅啾踿锹鞦揪愀耿楸臥
瞆,瞆赜聩唝啧喷瞚臗睍馈
瞇,瞇醚謎眯嚃跶脒毩晄眺
瞈,瞈暡聬嗡踚睔螉唫蹹眙
瞉,瞉嗀彀轂鷇毄毃瑴殸敼
瞊,瞊膅睚矋瞃瑭矌瞩曞曥
瞋,瞋暊嗔瞑暝蹎瑱瞙皟嗊
瞌,瞌嗑磕醘睶蹻暙啌嗌驕
瞍,瞍艘膄醙騪嗖骾驶喥腰
瞎,瞎嗐唁瞦暗矒暿髇疅疇
瞏,瞏寰睘靀裊霥襄裛蓑裏
瞐,瞐晶贔圼皛皨呈聶皇畠
瞑,瞑暝瞁瞋唄暊蹎幎頤嗅
瞒,瞒蹒瞞暪啸矙瞄蹣唡昲
瞓,瞓剮剈剾馴剧副割刮劅
瞔,瞔瞶皟賾嘖睻嗊曀膭晴
瞕,瞕暲瞳瞠曈蹱暐暄騿喧
瞖,瞖贀鹥睯譥醫瞀瞽笞贅
瞗,瞗鳴鴫鳵鵑鳲鴣鴨鴡鴰
瞘,瞘膒眶腷昛腘嘔彄暅脜
瞙,瞙暯嗼暵嘆瞋暝幙蹎膜
瞚,瞚頤赜瞋皟瞔瞆瞑賾璌
瞛,瞛暰蹤瑽磫嵷樅踨摐蹝
瞜,瞜嘍髏艛膢啛暵暥矆賾
瞝,瞝醨璃瞲螭瞻謧瞗皜畸
瞞,瞞暪瞒暔瞄啢晡蹣矙璊
瞟,瞟膘嘌驃醥骠幖瞸矄磦
瞠,瞠瞕瞳嘡暲曈蹚疃噇蹱
瞡,瞡嚫槻覵唲覸明眀眖貺
瞢,瞢曺菁寈萻軎書吉蓇曹
瞣,瞣贃噁患聴嗯愳憇聰驄
瞤,瞤瞯瞷膶睭喎睊昍皗晭
瞥,瞥晵鳖暼蟞瞀彆督膂鱉
瞦,瞦暿嘻礂睻曀疅瞎矒噎
瞧,瞧噍膲瞴礁吽脌睢唯哖
瞨,瞨蹼噗暵贌瞙轐暯瞸嗼
瞩,瞩嘱牑瞊矋蹁艑啹碥牖
瞪,瞪蹬磴噔璒膯嶝艠證酫
瞫,瞫曋嘾睴贉暺暐喗瞳暿
瞬,瞬橓瞵睜睇睬踭瞹踩疄
瞭,瞭暸嘹璙嶛膫曢撩憭蹽
瞮,瞮轍嗷曔噷撤驐瞰蹾慠
瞯,瞯瞤瞷睭眮晭腡膶喎昍
瞰,瞰噉橄曔曒歐皦蹾撖瞮
瞱,瞱曄皣哶嘩盽啈驊暺咩
瞲,瞲噊驈蹫瞝璚蹻驕曘騒
瞳,瞳曈瞕疃噇瞠蹱朣艟睻
瞴,瞴嘸膴璑瞧噍幠哖曣憮
瞵,瞵暽噒疄膦璘蹸磷驎辚
瞶,瞶瞔皟蹪膭靧賾嘪躀睊
瞷,瞷瞯瞤睭喎眮晭皗昍晍
瞸,瞸矂瞙蹀喋暎曗噪瞨驜
瞹,瞹曖皧噯暖懓暧嗳喛瑷
瞺,瞺噲璯膾懀嗆啥檜晗鱠
瞻,瞻聸曕舚贍膽噡嶦幨憺
瞼,瞼噞臉驗憸羷嶮礆險睔
瞽,瞽譥謦韾毊藖鼞萻鼙書
瞾,瞾曌琧琞豊朢譻堊讋聖
瞿,瞿霍雚瞾藿譻麈矍罌讋
矀,矀覹曔瞮鱵栿睵襒撇磝
矁,矁僽瞅曃硹嘫踿聮睞礠
矂,矂噪躁喍瞸喋懆臊瞁悞
矃,矃嚀聹暉瞱懧眸睴暷暐
矄,矄曛嚑臐暉睴瞫瞟暷腪
矅,矅曜嚁矔躍騽喈磖嚾矐
矆,矆嚄雘臒韄艧瓁瞜躩頀
矇,矇曚嚎朦艨礞懞檬豦蠓
矈,矈矏嚊瞶暥暻皞睅嗅龧
矉,矉臏礗髕璸曊驞蠙瞶臔
矊,矊嬵檰睎哘旿胻吘喲腳
矋,矋曞瞊睚睸膅睭矚瞩瞃
矌,矌瞊矚睚瞃曞曠矋膅啹
矍,矍罿譻薲麠蒦瞿罩霣麌
矎,矎瓊讂瞜嗄嚄矆嗩嚘嘍
矏,矏矈嚊龧暥瞶暻唱暿睲
矐,矐曤皬矔嚯嚾臛瞫躣驙
矑,矑曥臚嚧髗瞊瓐罏艫瞃
矒,矒暗晴睛瞎啨瞦暿驙喟
矓,矓曨嚨瓏巄龐壠龎攏馹
矔,矔嚾矐曤皬驩躣體嚯臛
矕,矕曫彎轡蠻脅吢鲁詧鸞
矖,矖曬躧驪矌囇開驌驅瞊
矗,矗皇蕌圼聶嗭畺晶臺瞐
矘,矘曭戃攩欓瞕嚊瞱黨眻
矙,矙曮瞤暇瞞睱嚪瞯閇瞒
矚,矚曯矋睚矌曞囑瞊瞩睭
矛,矛予茅罞子龵叒髳条髮
矜,矜矝黅狑肣霒駖鈐汵趻
矝,矝秢狑矜汵姈柃冷朎泠
矞,矞脀髷耆蓍鬠裔蟊斋蟸
矟,矟稍潲矠梢淌娋捎潴耥
矠,矠猎矟稓秸秥狤狜穡棤
矡,矡玃欔攫穫貜彏钁戄躩
矢,矢失宊芖天夫仧宎哭关
矣,矣穾枲実兾侌会淾奐集
矤,矤胅弞眣胦趹昳抶铁駚
知,知如铷矧刔刾奾刏剁夘
矦,矦戻蒺戾庆箧渼厌奐层
矧,矧知剐刔钏粌紖铆劮锄
矨,矨镺妖饫夶秗殀枖跃苁
矩,矩姖耟钜妲頬钷炬知萣
矪,矪烐炿辀媂锎姸輈鴙侜
矫,矫娇鞒轿硚桥姀骄妚挢
矬,矬锉侳趖铿銼挫烨铧娙
短,短饾浢嫂疫侸哣攳梪脰
矮,矮婑倭镂躷涹捼緌餧踒
矯,矯燆嬌驕犞嘺繑娝憍橋
矰,矰熷镨娉镥赠僧婄艚贈
矱,矱嬳镬耯韄艧鑊擭臒雘
矲,矲犤擺爘矮孊煆燦襬燬
石,石右有宥看蓿冇君喬百
矴,矴町耵玎盯叮靪帄訂尀
矵,矵刟劅刮剜利剛卲劯剮
矶,矶矾矹砚阢硎玑仉饥叽
矷,矷矸吇矴旴碲礛骬仔砡
矸,矸旰盰研砡酐硼盱骭砽
矹,矹矶矾砚屼阢旫硛饥軏
矺,矺吒酕馲秅仛瓱眊饦奼
矻,矻盵阣吃趷仡肐屹扢砨
矼,矼缸叿砸矶硘矹屸碰砋
矽,矽砂硋硵敌砹砌磠敢敔
矾,矾矶矹硎砚砜帆阢砃饥
矿,矿旷硛圹砣砈砿扩丁砺
砀,砀旸饧肠畅玚钖杨砌碭
码,码碢砠砪砢磵磆鸸礀碉
砂,砂眇吵渺訬仯尠杪秒矽
砃,砃硏研砚矾玬硎砽矶硑
砄,砄硖缺砆映咉眏硤砞岟
砅,砅砯砵硳硛栤阥仦眿栐
砆,砆硖砞畉砄硃硤缺硔眹
砇,砇砹旼盿呅破妏砬馼玟
砈,砈硘砸硐砙砺硱矶砽礀
砉,砉菪雼着羞害善若鬊萶
砊,砊阬碗斫伉吭肮航酛坑
砋,砋础碰阯耻矶杫砸硼矼
砌,砌砚劭旫劬勔彻砺硕砑
砍,砍缼欨欩欣欥欪软饮赥
砎,砎畍玠斺阶价吤骱祄硫
砏,砏昐馚盼帉岎酚肦朌砼
砐,砐昅伋破砜趿觙靸彶岋
砑,砑研砌硯砺砚硏枒碭硳
砒,砒毗眦皉骴仳玭玼础秕
砓,砓酘砹伇骰殁段羖祋殴
研,研硏砩砃硯矸砺砽硑斫
砕,砕碎酔砰砗伜磷碑礤硶
砖,砖礣碐磑传硔碵碛磒转
砗,砗砟硨礁磗砷碑砕硉磾
砘,砘砧磞砷盹砢砈磵硅碢
砙,砙硕砈砸硐缻瓳瓨硘佤
砚,砚矹旫矾觇矶现砃砌叨
砛,砛砱硆碒昑耹趻玪岒軡
砜,砜矾飒讽枫砐砚碸砿矶
砝,砝砆硡砞砄砩碂硖碪硈
砞,砞硃砆磏眜昩砄皌硖硳
砟,砟酢砗齚胙礁雕舴確碓
砠,砠磵碢硘礧礀砸硐硱碉
砡,砡矸砋砠礧硅馧砥碼砸
砢,砢酠珂呵何阿碉礀砽磵
砣,砣酡舵佗岮驼咜茈硥矿
砤,砤砲陁施袘拖柂砣矻粚
砥,砥眡阺呧碔眂低胝弤舐
砦,砦呰訾碧著硩硻鈭礜些
砧,砧碏磞磵硞礑砘硈砷碢
砨,砨軶眨豟呝矻阸砭碥昵
砩,砩研硑硄砞硏磞硳砃硯
砪,砪礀磵砠码砢碉磾碙硐
砫,砫硿軴註跓硑柱碰往硭
砬,砬砇砹旼碰破柆位盿垃
砭,砭眨砨姂柉抸硋贬貶磣
砮,砮硻詧硰沯譥礬驽奢砻
砯,砯砅栤硳阥砵侎沝仦硛
砰,砰砷玶砕呯軯磾坪硾碑
砱,砱砛皊昤駖龄玲聆昑鹷
砲,砲砤靤骲饱昫咆孢玸碓
砳,砳砶硱硒砟磵砧硘砡砠
破,破砹砐硠鞁砇皵皱骳帔
砵,砵缽钵砅体骵呠砯硳絊
砶,砶礑砧珀鹤磳砘柏硈砳
砷,砷硨磞磾磗礀砘砧磵碢
砸,砸硘硱砈磵砠硒咂矼碸
砹,砹砇破哎旼砓敧攲岐盿
砺,砺斫研硏砈磃砌砙砽呖
砻,砻沯硰詟茖聋砮著耆甆
砼,砼硂碒硆酫硷砎馠砛磴
砽,砽硼礀碉碢磵硯硎研礧
砾,砾斫研碂磃硏跞硡硳砡
砿,砿昿硇拡砜硛絋矿硡硤
础,础硼聉砋昢砒砸胐硎袦
硁,硁硜陉磕轻弪胫硲礛硿
硂,硂碒砼硆碴磴酫確馠硷
硃,硃砞砆磔珠跦駯砍眜殊
硄,硄晄珖駫胱砩桄矶侊姯
硅,硅磪硉硾礲礷磍礚礑碡
硆,硆碒砼硂碖砛碴硲眙饸
硇,硇磠砿硵硱硘砍眍脑呕
硈,硈碏礑硞磋碚砧碻碃磞
硉,硉礃磾硅磹礋礷礲礚硨
硊,硊陒峗确跪佹砈脆鮠祪
硋,硋畡晐峐骸陔胲骇咳赅
硌,硌碦略饹臵峈格酪骼硲
硍,硍硠碨眼珢限碾佷跟眠
硎,硎矾硼矶砽哵甽删碉侀
硏,硏研砃砺砽硼硯硑斫畊
硐,硐硘碢碙磵硱砠礀砈砸
硑,硑缾皏聠研骿砩饼硏駢
硒,硒硱砸晒硘磵砠哂硐礀
硓,硓礶硣磋礚咾磘佬峔磳
硔,硔碤碘碟礖砆晎硖礏碝
硕,硕砙颀顶颐顼顸颉顽预
硖,硖砆砄硤缺映咉峡畉陕
硗,硗晓饶哓骁峣跷铙侥娆
硘,硘硐砸砈砠硱碢硒磵矼
硙,硙皑磑磍碹磆磹磪礑碃
硚,硚峤侨轿骄鞒斫矫娇硫
硛,硛硳跡矹矶协砅砿劬矾
硜,硜硁硌踁礛陘硲俓弳硿
硝,硝睄砧陗琑倘哨帩碏礑
硞,硞碏硈碓皓礑砧磵磪礌
硟,硟唌駳鯅埏脠珽铤娫脡
硠,硠硍碨破眼碾碫桹琅硤
硡,硡碂磈砺砝硳砞砾砍碳
硢,硢畭賖艅駼馀稌梌悇礆
硣,硣酵礯磘硓踍礃礡礚侾
硤,硤硖砆聗殎砄陜峽梜脥
硥,硥哤駹牻娏蛖彨耏砣彬
硦,硦磽研碑硏碟磦哢砰礝
硧,硧碙确礌磵礀碢砢硐硒
硨,硨砷磗磾砗硉眒碑礃磞
硩,硩磛誓銴晢錾砦乴砉哲
硪,硪皒睋饿峨俄哦锇珴戙
硫,硫砎酼碕艈琉疏砼硚旈
硬,硬碩硕硯峺磌碮碝骾砚
硭,硭砫碪硈硿铓礑砶馧碏
确,确硧硊磄硝碙砷礀礦唃
硯,硯研砽靦覠砚硏覗硼砃
硰,硰砮砻乷省礬娑挲沯詟
硱,硱碅硒砸硘硐砠磵碙礀
硲,硲俗裕峪唂硆谸輍豁綌
硳,硳硛砅碗斫砯研砞捇矹
硴,硴砒硹碄椛硪婲誮埖硤
硵,硵磠硇硒硱破硕矽碪砌
硶,硶侺琌荶梣礤埁磮砕碜
硷,硷睑碒殓崄脸砼检险验
硸,硸磞婩砷磗碑碋磑礁磄
硹,硹倯碄俬礠硴磫矁蜙硪
硺,硺啄琢椓豚隊诼烼磙豩
硻,硻豎鋻礊砮譥署毊礕馨
硼,硼砽礀硎础磵礧磞碉研
硽,硽碖馣碴醃碕硆礆晻確
硾,硾硅碀磾礷礲硉磹磍砠
硿,硿磕聜啌倥鞚砫崆谾硁
碀,碀硾崢睜踭砰酻偁礡俘
碁,碁諅朞謩蜝謈驀蓦晷蟇
碂,碂硡砾礞砞踪碛騌砝碪
碃,碃磧磍碻碹礑磆碏碡皘
碄,碄醂崊晽惏琳諃硹啉綝
碅,碅硱砸睏硒硘稛棞砈硐
碆,碆錃婆峉苳笿鍙磐笗鍪
碇,碇聢啶腚琔砊碮婝諚椗
碈,碈磭碷礄磻磖崏礌礪礭
碉,碉晭礀磵砽睭皗砠礪硼
碊,碊醆踐琖俴牋輚帴殘諓
碋,碋礀磞磑礹碕硸硙磵砷
碌,碌睩醁礞琭娽礘硍碂硃
碍,碍礓礋碠礂磚疇磆礝礃
碎,碎醉睟晬砕崪脺踤琗砰
碏,碏硈礑硞砧碃磞礌磳磋
碐,碐睖陵踜砓稜崚倰砖蒰
碑,碑磾磗砷碟硦硨俾硸睥
碒,碒硆硂砼硷砛磴砱馠崯
碓,碓硞礁睢唯磪蓶硅醀雃
碔,碔倵砥珷赋賦碱硪砒陚
碕,碕磕畸礄碲碖硫硽磮陭
碖,碖崘硆睔硽棆稐惀踚陯
碗,碗睕晼畹椀砊琬啘硳帵
碘,碘礖碤硔礇晪碵睓琠帺
碙,碙硐磵礀碢硱硧罁砸碉
碚,碚碻磍礑碲磳硈礛磕礌
碛,碛磺磧赜碽磽磌磑碩硯
碜,碜磣磟醦鯵骖鲹椮贂醪
碝,碝瑌偄碶碤礖硤陾硔硖
碞,碞礨曡曐疉雼碧疊菪罍
碟,碟碤硔礏磼碑磦礖硦砞
碠,碠磚聤礂礃碻嵉疇碍磗
碡,碡碹磰碃硅碻磍礂磋礓
碢,碢硐磵砠礀硘砽碙磆礌
碣,碣暍磆礍磶碭礭碅偈硱
碤,碤礖碘硔碟磼暎碵碝礏
碥,碥磄礪礦瞩碻碷蹁磭碿
碦,碦硌髂喀礚楁愘碚略蓨
碧,碧菪雼岩礜碞礐礨窘譽
碨,碨硍硠隈碾喂眼偎眠椳
碩,碩磌碽碵磒暊磧硬礩頢
碪,碪礑礍硯磪碂砡磍砝硭
碫,碫碬磤礹碾砥碱锻硠碨
碬,碬碫礹磤嘏碾碼礪砥腵
碭,碭暘畼舓晹腸瑒睗啺踼
碮,碮瑅睼礵碇偍碍硯礧礓
碯,碯腦硥硆磠硝礯硲砼堖
碰,碰踫砋椪矼諩哑桖湴掽
碱,碱磩瑊醎晠椷峸磝槭輱
碲,碲碚碕磅碻矸啼蹄硑矷
碳,碳砆硤砞羰砐硡破硃畉
碴,碴硂硆確馇磴硽嵖礄碒
碵,碵磌碩磒碽礖磸碤磺瞋
碶,碶碝硖碤偰稧礖礇硤喫
碷,碷磄磭磵礪碿碈瞃礀礌
碸,碸砸偑楓碉晍硱諷碾砜
碹,碹碡磧暄碃磍睻礓碻喧
確,確碴硂磪砼馣硽礄磕髉
碻,碻磍碚碃皜礑碠髇碹礌
碼,碼礹砽磶礪磵碉碬礝碾
碽,碽磒磧磌磺碩靧碵賾礗
碾,碾磃碨冁陙礦辗碬碸蹍
碿,碿磭碷磄礦礵礳礪碥榍
磀,磀磁磓硑礎礈嵫磈縌硡
磁,磁嗞磀鰦禌稵镃礈糍嵫
磂,磂磖磳礛礳礑碈碢硌碙
磃,磃蹏碾嗁螔褫砺矾砽昕
磄,磄礪礦碥碷磞磍磵礔礳
磅,磅碲礑碚磍碃磳碕确磱
磆,磆碢睊碃礀礝磵磹礌碍
磇,磇磂礳確碕礪礝礄碩碙
磈,磈魄硡聭砚瑰隗傀砄砞
磉,磉褬嗓磎槡礯磥縔搡蹂
磊,磊藞嘉馫舙譶帬矗蕌藠
磋,磋硈礑碏磰硅碡礶嵯醝
磌,磌碵碽碩磒磸磺磧瑱瞋
磍,磍礑碻碃磄礂碚碹礌礓
磎,磎蹊騱嗘嵠傒磉徯膎鞵
磏,磏砞馦硃砆硑砩碟傔疎
磐,磐礊馨磬箸罊署臀硻毊
磑,磑皚硙暟磺碹磧靧隑硅
磒,磒碽磌碵磧碩磺靧礗磹
磓,磓磀膇檤槌髄礎塠縋碇
磔,磔硃礫磲嵥榤礤磼傑磜
磕,磕礄硿瞌硁碕醘礚磮礛
磖,磖磂碈嶍礥礳碴礄矅礶
磗,磗礡硨磚砷磌礃碠碑磾
磘,磘暚瑤硣鎐嗂熎傜榣硓
磙,磙磢硺硋礮磉磣畡硲晐
磚,磚碠暷磗礂礃礡碍疇暿
磛,磛鏨硩塹蹔礱誓暫蕓雪
磜,磜暩礤穄鰶憏礯際暸磔
磝,磝礉磩璈碱嗷隞謸傲躈
磞,磞砷礀磄砧磵硼礔礑砘
磟,磟疁蹘磣嵺髎僇璆豂賿
磠,磠硵硇硱礳碯碅砹硤呕
磡,磡硎磞硼礀磩碋础砌嘞
磢,磢樉慡摤傸塽騻磙硤硺
磣,磣碜磟醦幓驂贂襂犙疁
磤,磤碫碬碾礉磝磩瑕礹礅
磥,磥礘磉傫礯礞嫘磦硍硣
磦,磦礝碟醥磌碠瞟磹碽磒
磧,磧碽靧賾碹磺磒碃磌礗
磨,磨磿黂膤摩暦麾麿蘑譍
磩,磩碱槭醎磝摵瑊嘁傶慽
磪,磪硅礶確碓磍磄礭磵礑
磫,磫暰瞛瑽蹤傱嵷樅摐礎
磬,磬礊韾馨罄磐毊謦譥瞽
磭,磭碿碈碷礪磄礌礳曞礦
磮,磮磕碕礄碈磆硶磖礚碏
磯,磯璣僟鞿嘰機穖譏蟣耭
磰,磰碡礂碹磋礃礑磍碃硉
磱,磱嶗僗嘮朥礯橯憦耮蟧
磲,磲璖磔碟蟝磦碤碝磷礖
磳,磳礑磂碚噌僧礛硈碏磍
磴,磴瞪硂碒蹬碴僜璒硷證
磵,磵礀砠碢碉硐砸礌硼碙
磶,磶碼碣礍礹鴰鴯碍礘碻
磷,磷疄暽璘隣嶙瞵噒蹸僯
磸,磸磌碵磒碽碩礸礗碤磺
磹,磹磾罈礭曋礋硉礂礓磒
磺,磺碽磧磒磌碛曂磑靧璜
磻,磻皤碈旙幡嶓蹯僠橎礄
磼,磼碤礁磺碟礏磔碘磽磌
磽,磽硦髐碛硅磺嶢磼曉碟
磾,磾磹硉砷硨碑砠礋硾磞
磿,磿磨曆蘑暦黁麿谮屠摩
礀,礀磵硼砽碉碢磞砠硐碙
礁,礁碓磼瞧砗硞磞僬硸砷
礂,礂礓暿瞦磍碠磹僖礃磚
礃,礃硉罉礡碠礂磗磚磹礋
礄,礄磕礝碈碕礌碴嶠確磮
礅,礅橔僌憞蹾镦礉噋譈暾
礆,礆嶮醶瞼硢儉羷碖驗臉
礇,礇礖碘碤隩噢碶碝墺燠
礈,礈穟璲檖襚隧譢禭嬘繸
礉,礉磝曒皦躈璬礅璈嗷傲
礊,礊馨磬罊磐毊擊薯韾硻
礋,礋磹醳硉曎碍磾礃礂殬
礌,礌礝磵礭礑磍礵砠礀碷
礍,礍碣礑碪碻磶碃嶱轕碡
礎,礎檚璴磫憷磯儊磀硜韼
礏,礏碟碤曗硔磼嶫檏礖磺
礐,礐觷嚳雤碧窘黌兽硻寷
礑,礑硈碏磳磍礌碻礶碃硞
礒,礒儀礞嶬礅轙碡碛碂艤
礓,礓礂疅碹磍碍疆磹磧礭
礔,礔磞磄礪礦磃礳碷躃礰
礕,礕譬硻菪璧署薯礨窘礊
礖,礖碘碤礇碵硔晪磌璵睓
礗,礗矉碽礥礩磧磒馪礸磌
礘,礘隰磥儑礠磶韅碌礞碣
礙,礙懝譺儗擬礎礈磉磀礟
礚,礚礷礑磍硅磕硉礶礛礭
礛,礛磂磕磳礚碚礷嚂硜礝
礜,礜譽臖轝寋碧謇弿春舉
礝,礝礌礄礵磆碢曘磦磍礑
礞,礞曚儫矇朦艨碂懞礒檬
礟,礟礮礉駁磝畷硪礅硥磤
礠,礠硹聮礘磯磁僽矁嬨硣
礡,礡磗礃磚碠磾磹磌磺碑
礢,礢懩攁磧磺磕礗碽碃磮
礣,礣硔碱礉砖幭碫磝礅磦
礤,礤磜磔硶嚓聺暩櫒檫镲
礥,礥礸礩礗磖碽磒碴曊磺
礦,礦磄礪碥碿礔碾礳磭曞
礧,礧砠硼砽硐磵砸碢礀硱
礨,礨罍碞曐曡暑曅曇礱疊
礩,礩礸礥礗碽碩磒碷磧磸
礪,礪磄曞礦碥矋碉碷礔磭
礫,礫皪嚛瓅躒櫟轢磔擽觻
礬,礬攀蠜鐢簭鍪鏊砮箞篸
礭,礭礶礌磹曤礂礓磪皬磍
礮,礮礟駁畷陬瞰畩磙礅硪
礯,礯磱硣磉磜磥磎礫礏磼
礰,礰瓑轣櫪攊礔礳爏礪讈
礱,礱讋聾霅蠪蕓霻辈礨壟
礲,礲龓硅硉磪礷硾礚磍磞
礳,礳磄礪磂礶磭礔碿礦碈
礴,礴磞硽礁礲硸磮确磄碕
礵,礵礌礝碿磄礦碮碷磭礔
礶,礶礭磪礑磄磹礳矔礚硉
礷,礷礚硅硉硾礛礲磾礶磍
礸,礸礩礥巑礗磸曊讚瓚臢
礹,礹碼碬碫曮礪碾碋磤磶
示,示乐忈亍禾氶尗忝元术
礻,礻衤扌彳久氵乄犭吥丶
礼,礼札祉社补孔祧杹糺乿
礽,礽初袇衴视裯朷禂襉祊
社,社杜祉礼袦袢袣扗裆袿
礿,礿袀彴杓扚构抅袧袎衬
祀,祀杷祖禗杞禡祸禂椚禍
祁,祁补礼郗邗祢衲邳郴郊
祂,祂衪杝彵袣牠袍袘袦袖
祃,祃杩禍禋祌袒衶禆袓袔
祄,祄衸扴忦价吤斺炌玠紒
祅,祅袄祆祑枖衭袟祙扷秗
祆,祆祅祑衭袄袟秩枎柣袂
祇,祇衹祗袛祳秖祅禡裖袄
祈,祈析柝祊折禠褫褯裄衴
祉,祉杫袦社礼扯苮札祖裇
祊,祊枋祶彷衴祈祷初杤袥
祋,祋杸役袯投祾殶裬衼羖
祌,祌神衶袡祜袖禆禅補袆
祍,祍杄衽柱栍杔杽栝粁杻
祎,祎袆衦祥祮祶祜祌衧栉
祏,祏袥祐裙柘袹衵袏裾拓
祐,祐袥祏袏袙禇祚裙祜褚
祑,祑袟祆衭柣祅袂秩祙祩
祒,祒袑衵袹袙袓柖褶禋祻
祓,祓袚柭秡衼袯拔枚被衩
祔,祔袝柎裄拊桁袧袻袦衬
祕,祕袐柲秘禌珌馝铋佖视
祖,祖袓祻袹襇禍禂裯租裥
祗,祗袛祇衹柢秪彽袄抵牴
祘,祘冧标菻秝荪眎两秐林
祙,祙祩枺袜袾衭袟祑秼祅
祚,祚柞秨祐袸袥裄神拃杵
祛,祛袪衭祑祆袂祙袟祅祩
祜,祜袩袖袙祌祮神祰補袹
祝,祝視柷视祼衴裸禔枧祱
神,神祌衶袡祜禅祥禆補袖
祟,祟崇萗岽票亲曓崬芉稁
祠,祠柌袔福裥祻祖袓禂襇
祡,祡柴枈紫姕粊鬃毕毞祟
祢,祢袮称狝裄祁栋祚祣袕
祣,祣旅玈衹祇袘祳裖祢裉
祤,祤栩挧袉翃褟翉初袀禢
祥,祥禅样袢祎褝神禚袆祌
祦,祦禩褀祺襆褉禖禊襍祑
祧,祧桃挑狣恌铫桄鞉珧礼
票,票栗萗蔈崇雲祟霬蕓蔂
祩,祩袾祙袜袟秼祑衭株袂
祪,祪桅禟诡襜恑硊禂蛫袍
祫,祫袷秴裕拾粭裣袴柗孡
祬,祬秷桎禋徑挃裎褣祒福
祭,祭筡栥察筿荼秶奈茶蔡
祮,祮袺祰襠袩祜祎桔褃襦
祯,祯桢赪初颓禎祓襫祈褀
祰,祰祮袺襠袩祜袖楛梏袿
祱,祱裞祶棁視祝捝税视说
祲,祲梫褄複褸槾祾裋禝祋
祳,祳裖桭禠振祇禡褫衹榐
祴,祴裓械槭悈磩襶摵楲狨
祵,祵裍裀祻襉梱捆衲禂裥
祶,祶祱梯裞挮稊祎祊褅禖
祷,祷梼祊袥祏袸褨袆袏裤
祸,祸禡禍裀褓褐襕祀襴襉
祹,祹裪袧袘袍布袥裄袴袀
