character,top sccs
諞,諞謆詬謘詣諨讘誳謶諪
諟,諟讄諨誳謃諻誱讘調諚
諠,諠誩謞譆諻誼誯諱謮謴
諡,諡誝詮譮詥謒論諗詒誰
諢,諢譚譂譯譆諥諿諱譝諽
諣,諣詛讄詷詌調譋詗誷譝
諤,諤謂諝諿諱讗誯謌謣譯
諥,諥譚諈諢謹諲譆諠詚讍
諦,諦謫誦諳詰謗謪詳諯話
諧,諧譡諎譜譄誥謵誻誚詌
諨,諨謳誼詎誆諣謞詛誯詷
諩,諩訕訨註訌証訰詁碰謚
諪,諪譸諄謞誩譆諻諱請讀
諫,諫誎諌謀諜誄誅誺課詄
諬,諬警謺謷朁醔譼謦譥睝
諭,諭論讑譮詢詂訽謒誧譣
諮,諮誻譗詻誙誇諂謐譛譒
諯,諯謊詌詁讄詘諦讝荋諣
諰,諰誋謥誌認譓讝諟課訳
諱,諱讗請譆諻講誩譸諤諿
諲,諲讍譚諈謹讙譠諥謃詚
諳,諳誩譡譜謞詰譄諎謪謫
諴,諴誠誡輱羬諏謶諷謸試
諵,諵誧訷謫講諎謪讕詌詴
諶,諶譪譡詓讄詌詛詿諜詘
諷,諷訶颽詗詷調謶諴詞譋
諸,諸諾誟諎譜詰誥諳譡詺
諹,諹舓謁諤訝謖譪輰譹誢
諺,諺諓詑齴謆詫唟諘謬誏
諻,諻譆謃韹諱誯謹諠諨譯
諼,諼蘐諉謖謏瑗叢謱謢誛
諽,諽譁譂講訷讜諀詳諢誖
諾,諾諸諎詰誥譡譜讙諳詿
諿,諿讘譯謂謃諤讍諱譝諢
謀,謀諫諜諌課誄誎誅詄諛
謁,謁譪藹諨誯謂諿諤諶讕
謂,謂諝誯請諤誷諿諣語謣
謃,謃諻讍諿讄詚譯諟諨諢
謄,謄膳賸黱蹅腾騰膡膌鰧
謅,謅詔譡諾譜諸謵譳誥語
謆,謆諞誫謘詬謶誳詝讝讕
謇,謇弿骞謩譽謈賽舂搴譻
謈,謈諅謩昬弿謇朞臱曅蜝
謉,謉詋訦誱諟誽訅謶調訙
謊,謊詵諯読誥訐詩詰諱諦
謋,謋誅諜誺謀詄譲諫讓譟
謌,謌諤詞訶譳讘讄諨譋讝
謍,謍營醟篭箁訾膋黌詟晉
謎,謎瞇詸謰譢讁訩誂訸諃
謏,謏詜謖謾設誏誛詖謢諼
謐,謐誻譗詻諧譄諮譜詒諸
謑,謑諓鞵騱譔蹊諉磎謟讃
謒,謒詥譮誝論諡詒諂諭讑
謓,謓謮謴謱讀謨諆讂譨譆
謔,謔謯譃謼譫讙詯誱龍詎
謕,謕諕謶鷈謜誫譃誳詬蹏
謖,謖謏誜諉謾諼誛謱謁諹
謗,謗譊諦諤諳訪謂譡謫謣
謘,謘諞謼謆誳諢調諟謃謶
謙,謙誎諌謀諫譧諜誄誌課
謚,謚齸註镒諩謐詻譒諮詁
講,講諽請譁讜諱諵誧訷誖
謜,謜謕謶誫譧諰羱課誳讕
謝,謝詡翧詂諏誐譵謿譾詏
謞,謞誩諳諪譡誼諨諠詰譠
謟,謟謡韜謵諳詣謪謫話譄
謠,謠誵韸讑詺誟瑤讒譮詻
謡,謡諍謟話譒諈謫諦詣詊
謢,謢護頀謱誛叢謏讂彟謾
謣,謣譳譆譸譠謂譚諤誯語
謤,謤譟諜譨譔謣讓課譳譿
謥,謥譓諰認誋讝謧誌謶誏
謦,謦韾警毊謷譥瞽霅譬轚
謧,謧譳譑譎謞誦諧譡諳諦
謨,謨誤諆諜韺謓譨謮讜謴
謩,謩諅謈謇蟇驀朞碁弿蜝
謪,謪謫諳諵誧諦譡誼譎謟
謫,謫謪誦誧諦諵誚諳誷譡
謬,謬謲髎診镠蹘磟轇豂賿
謭,謭譾讜訲訷誼訶謓諆謨
謮,謮謴讀謓謱韻請諠講謨
謯,謯謔譃譫詯謳謞詎諂誼
謰,謰讁誱譴諟謎謉讙調誔
謱,謱謾讂謓讀謴謮護譆誛
謲,謲謬診摻黲磣誃驂嘇鏒
謳,謳誆諨詎誳誼詷譋謯諣
謴,謴謮讀謓韻謱請謂誯諿
謵,謵謟諧詔諂譖譑謅譎譒
謶,謶謕誫誳諕謜譃諞謆謘
謷,謷譥警謦毊詟瞀謽驁髻
謸,謸譤譀諔誡誠璈諏磝譈
謹,謹譆譚譁讍諻諱諥讜諲
謺,謺摯暬譥贄警驇摰謽謦
謻,謻譏誮譢誃誸諑懿訬診
謼,謼譃謘謔諞謶謯諱諢謳
謽,謽譬譼譻霅萻謷害書寈
謾,謾謱誛讂謏諻霞諿謖讀
謿,謿譋譝讄訠諣詌訶勏訷
譀,譀諏譈謸譤諔鷻敨誡敿
譁,譁諽講謹讜訷詳詿韡譂
譂,譂諽諢誀訷譝譚諀譁講
譃,譃謯謔謼諕謶謳諞謞誼
譄,譄譜譡諳諧諎謐謂謟譖
譅,譅誣誙詶誑詔誮評訛詡
譆,譆諻譸謹誯諱諢諪謣譠
譇,譇誇譮誝詥諂讑諡誻諮
譈,譈譀鷻蹾誡镦譤諏謸礅
證,證詮誈瞪誝磴誇護詥讃
譊,譊讒謗譟諜讀謣諻講譆
譋,譋調讕諣詷讇詗詌誧詛
譌,譌讔謟譩譿諞謶譨謫謧
譍,譍膺鹰麞鷹贋厝黂詹鬳
譎,譎誦譑謪譒諧謧諝譳謫
譏,譏鞿耭謻磯璣諁讖誃鐖
譐,譐諄誖譚譿諽讂讜諲讚
譑,譑語譒誻誇譳譎謧諙諝
譒,譒諙譑話謡諧譎誘謫誻
譓,譓謥韢誋諰誌譩諪諄譿
譔,譔諆譟誤讓諉謤謱譲謨
譕,譕讌譙訷譁諽譾訲諀謙
譖,譖譛諝語讙讅譄譜諧諮
譗,譗諮誻譛謐詻譒誙諙諧
識,識誐試讖譭睵誡韯讞譈
譙,譙誰誥譁譕誨讜諽讌講
譚,譚諢諲謹諥譂譆謣讍諈
譛,譛譖譗誻諮諧諙謐讙讚
譜,譜譄譡諎諳誥詰諧詀諾
譝,譝讄諣讍誀詷詛譂諿諢
譞,譞誤譨諿謴讝讕譟課讉
譟,譟誤課髞諜譔謤譊讓謀
譠,譠誯讀譆謣謞諻諨譚諲
譡,譡譜諎誥諳詰詯譄謞誼
譢,譢禭礈穟璲檖鐩襚謎繸
譣,譣諗論羷諭謒瞼誜詅驗
譤,譤謸譀諔躈譈璬誡敨諴
譥,譥謷警聱謦瞽毊骜睯鳘
警,警謷譥謦譬詟毊謽謺韾
譧,譧謙謀謜謶諌諫課誴誎
譨,譨謱諱謤譞譿謴謓謨譩
譩,譩譿諱諠譨譓譆譸謱誖
譪,譪藹謁諶讗譡謞諜請譸
譫,譫謯謔舚諂讙謒詭譃讉
譬,譬誓謽譼謦萻霅菩譻害
譭,譭識讖諏譀諔讝誐嘏譤
譮,譮讑諡謒譇諭謪誨諂譡
譯,譯諢諿諱謃譆諻諤讍譚
議,議鸃諘義譾讓譹譈試羲
譱,譱鼃宔羊幸囍韦羛竈辛
譲,譲讓譔諘謤譟誒謋議誜
譳,譳語謣謂謧諨謌譡謞譸
譴,譴讉讁謰諟諤諿譫誱讙
譵,譵轛讖謝譭鑆嚉誚諧凿
譶,譶舙辜嚞事蓽享亳羣罼
護,護頀謢謱彟讂讃彠謾證
譸,譸諪壽譆誩薷諱謣請蘦
譹,譹謱譞議謆諹譸讓諄譟
譺,譺礙謎讁譧擬韼諁謰誜
譻,譻霅讋罯謇豊謽琧譬瞾
譼,譼譬謽霅寷譻擥謦軎蘴
譽,譽臖礜謇轝弿謈譻骞賽
譾,譾謭訰譕訲諏議讌誡訷
譿,譿譨譩諤謹諱謤讗謣譚
讀,讀謴謮譠請謓謱誯譆諪
讁,讁謰譴謎調謫誱諟謉詭
讂,讂謱謓謾謴護讀矎竷讃
讃,讃讚謴護讂證謮諝謱譛
讄,讄詛諣誳譝謃詌諿讍諟
讅,讅諳諨譖謪諙譳譎諸謟
讆,讆讏諐鲁響胷蘴噵寷讐
讇,讇譋讕調諣諵詷詛詌謫
讈,讈轣瓑礰謕謟誣櫪譃讁
讉,讉謴譴諿讕謮譩譞譨譫
變,變孌夑孿愛鑾欒蠻奱攣
讋,讋霅譻琧礱聾蠪驡辈霻
讌,讌譕誹譙譁試諽訹訷誐
讍,讍諈謃諲誆譝諿詎謹誀
讎,讎雦雔雠龓笜篩儺儲罐
讏,讏讆鲁噵喜兽軎胷窨嘗
讐,讐譼筶箁籗謦譬警筈篲
讑,讑譮諭譇誨論謒諡詢謠
讒,讒譊謱謮諻譆譔讂讘謠
讓,讓譲諘譔謤譟議譨諜詓
讔,讔譌譫譨譩讗諝譿護諙
讕,讕譋讇讝調詷諵誷謂誧
讖,讖識譭誐谶譤譵韯攕試
讗,讗諱請諤誩諳譡誥譪講
讘,讘諿諨讍讄諟諢諈譝謃
讙,讙諲謹譚諾謔譁諧譖譡
讚,讚讃謴譛諝讀讂譖護謮
讛,讛鞤謹堼鼞摯篫藝撉鼜
讜,讜諽講譁謹誖諱譂譆諢
讝,讝讕讘謌諯誫譋讄謶謘
讞,讞識譤謸誡諴瓛讖誠試
讟,讟薷蘦譸蕾誩謗蠪霛蘁
讠,讠亅丨氵饣忄厼个丫丿
计,计让讣诎汁竍针训诽讦
订,订饤钉讨玎耓门圢灯讧
讣,讣让补计钋圤扑仆朴认
认,认从朲汄狄玐釞丿队圦
讥,讥训竌饥玑讱讪忛帆叽
讦,讦讳讲许谉诂计钘诽圩
讧,讧冮辽江证玒诬讥让订
讨,讨订籿村忖衬门饤诃对
让,让计讣诎圵讪辻址讧训
讪,讪训诎汕讥圸屾讷让川
讫,讫圪忔忾扢犵籺汔杚趷
讬,讬饦圫飥诧秅话耗讳讦
训,训讪讥圳诎汌川玔刋钏
议,议仪汊权舣钗餀仅汉扠
讯,讯汛诹讥斌凧沠试阠湫
记,记圮词玘圯诅忋谴讵诃
讱,讱切讥训诃旫舠灱冽竌
讲,讲讦谎畊诜皏诽计钘井
讳,讳讦诂诘诗谉许诖诜讬
讴,讴沤怄伛呕讻抠眍讷愜
讵,讵诓诅谴诇调谓谊诣诟
讶,讶冴犽诜讱订伢讦讫玡
讷,讷讻讪呐讱训讴汭诇钠
许,许讦诜吘讳诈汻仵忤旿
讹,讹吪沎杹靴龀漎訛魤儿
论,论谂沦诊伦抡诠冷凎讼
讻,讻汹忷讷谜讴訩逖讪悩
讼,讼昖炂玜彸妐忪伀论凇
讽,讽飒沨砜枫网讥愀呱风
设,设没坄伇吺役谈羖竐祋
访,访坊昉谅仿汸厉诜说诪
诀,诀决谀识诔決块课泱玦
证,证讧诅诬诓讵讪泟诎讥
诂,诂诘讳话诰谉诽诖谱谙
诃,诃词坷诇讱问间谉诵调
评,评坪怦诽玶详泙讦谉许
诅,诅讵调诓谊谴谓诇词证
识,识谀课诀怾伿炽胑馃积
诇,诇调讵诃词训诅坰谉炯
诈,诈怍昨作迮阼炸谯许妰
诉,诉坼诋讥昕盺诟沂跅泝
诊,诊昣袗沴眕抮跈飻珍聄
诋,诋坁怟坻诉试眡眂诚氓
诌,诌谄诒谙诤诸迨诠冶凔
词,词诃闶谉调诇诵诅谝阑
诎,诎讪训让饳计讥址卌泏
诏,诏谘貂语沼诘谞祒玿袑
诐,诐坡怶玻波狓彼铍柀议
译,译泽迳怿浲诤详逢诨铎
诒,诒冶饴治坮诠谄铪怡饸
诓,诓讵谊诅恇谁谴证塸谓
诔,诔诛谏凁沫谦沬洙诀课
试,试诚斌诋诫拭减減淢烒
诖,诖逹谨迬诘诂洼违讳诰
诗,诗诪讳诘诖讦谔请访诂
诘,诘诂诰谙谱语诺讳话谓
诙,诙拻咴饮洃恢脄坎欥烣
诚,诚诫减试減喊城烕诹滅
诛,诛诔洙沬沫洡谦浨陎昧
诜,诜冼讲诛许铣讶讳洗访
话,话诂诘谐诣诵谓语诸讬
诞,诞涎涏埏铤烻脠挺狿唌
诟,诟垢诣斒谝洉讵逅姤谓
诠,诠凎诒逧淦洤捦论惍凃
诡,诡垝恑峗桅姽陒祪佹跪
询,询狥泃狗洵坸词徇诃诲
诣,诣谓诟谐讵谊谙话请诓
诤,诤译详铮净诌诨狰谗谁
该,该垓咳晐烗陔峐姟侅赅
详,详垟诤译诽诖谨评珜讳
诧,诧讬垞诖秺谆讫记挓谨
诨,诨库厍恽译诤谇谆详珲
诩,诩翊翔珝挧栩祤詡诏辺
诪,诪涛诗访诔谤陦谦庑诛
诫,诫诚悈减羢喊城臧滅慽
诬,诬辺证讧垭邲讪逦讱冮
语,语诰谱诘请谓谙谐谭谔
诮,诮消陗淌哨弰谱俏畄谐
误,误谋悮课谍谟悞诶娱谀
诰,诰语谱诘诂谙谐诺谁请
诱,诱诿锈唀讬琇侨话谤访
诲,诲谁谯诓谊询谆海诰诵
诳,诳餁俇誑证诜谁狌诬狂
说,说谠涚帨捝锐祱悦诜访
诵,诵谉谓谪词谊谲诃调诇
诶,诶竢埃涘误唉逘娭俟读
请,请谓凊谙语诘谞谔谐诣
诸,诸谙谐渚话堵诘谱诺谮
诹,诹娵棷掫陬诚噉澉讯诫
诺,诺诘渃诰谱谔诂诸溠馐
读,读谟渎该谏诶诿谍诙椟
诼,诼涿琢啄椓烼豩硺豚塚
诽,诽诂计评讪诎渄讦详猅
课,课谋谀误谍识淉诔诀谦
诿,诿涹倭潻诱唩谡踒溇凌
谀,谀诀课识谍谏误认谟决
谁,谁谯诓诲進准诰淮讵猚
谂,谂论淰惗埝凃唸冷凎稔
调,调诅凋诇词讵谓谉诃诵
谄,谄诌埳馅诒谙惂谵旓诡
谅,谅凉琼谏诔晾惊访弶涼
谆,谆埻惇厚凛渟淳稕蔊弴
谇,谇埣淬悴焠踤晬猝祽琗
谈,谈淡晱埮舕餤锬惔睒焱
谉,谉诵词谊谝谓诂诃调诘
谊,谊诓谉谓诅讵诵词诣请
谋,谋谍误课谟堞惵湈凓谏
谌,谌堪诓谨谟谒愖诅遦谊
谍,谍谋课谟误谀堞谏谦惵
谎,谎谛慌讲诘谠塃讳端谦
谏,谏诔凁谅谦谍诀涑湅涷
谐,谐谱诣诰话诘谞谙语请
谑,谑谵谭瘧瀘讵诓谴逹诖
谒,谒谓谩竭误渴谡遏诣诅
谓,谓请诣谊谞诘诵谉语调
谔,谔堮愕请语谓诺谤诰谭
谕,谕渝愉喻俞兪瑜揄偷羭
谖,谖愋暖禐湲瑷瑗喛楥嵈
谗,谗馋诤搀逘谡邌读诶诌
谘,谘愹谮饹塎餎诏塔貉烙
谙,谙谱诘请诰谓语谤谐诣
谚,谚遃喭楌嵃厖偐庬尨彩
谛,谛谎谪谤崹诘谝讳访蹄
谜,谜讻瞇餸迷毩逃计眯垯
谝,谝谉诟斒词谓谴诵谊遍
谞,谞谓请谐语诰馉壻谮谙
谟,谟谍误馍暯谋慔漠幙读
谠,谠说谎谅诜访谦诮觉诡
谡,谡谩溭诿谒谖稷谬獿设
谢,谢塮诜讲训诹燍谰墛讱
谣,谣遥摇瑶滛揺谖饀话墦
谤,谤谙谔请谱谛访语诪谖
谥,谥溢镒谧貖搤艗嗌獈隘
谦,谦诔诛谏溓课谍谅凁赚
谧,谧谥榓诒饴诸泾镒隘湁
谨,谨谭馑诖迬逹墐慬谴遦
谩,谩饅墁迃镘馒慢谒獌谡
谪,谪谛诵谊墒词诃话谙墑
谫,谫廁读廐说彅详诃向廦
谬,谬憀镠璆熮摎蹘嘐漻嫪
谭,谭谨遦谓憛罈语谑潭曋
谮,谮谐撍谘憯语潛诰谱诸
谯,谯谁潐诲诈诰谉僬憔谵
谰,谰阙闲阋澜斓阅谀阑闹
谱,谱谙诰诘语谐镨潽诂诮
谲,谲诵话语谐译诸潏谱獝
谳,谳擜旘谶献囐獻橶赋撠
谴,谴讵诅诓儙谓谝谨谵谩
谵,谵憺曕幨檐噡嶦谑聸澹
谶,谶鑯瀸懺谳殲襳讖攕韱
谷,谷合仺亽台筨仑餈咨答
谸,谸輍焀豁硲裕鋊谿唂穃
谹,谹欲紘纮鈜谺絋絃絘敋
谺,谺彻谹緆釾衔犽衍欲錫
谻,谻豃勰豅翖汛訊闬飜瓠
谼,谼硔鉷緓豅鍈錪偀鉠輁
谽,谽給鋡馠给餄綸鉿祫佮
谾,谾硿嵆豅饁鞚豓鹆谹狌
谿,谿豁谸綌雞绤鋊輍濌裕
豀,豀徯縘貕磎豯溪傒鞵騱
豁,豁輍谸鋊硲簳谿唂諮裕
豂,豂磟繆僇髎鏐镠缪謬穋
豃,豃徹鰴饊徶黴儆徼僌橄
豄,豄續襩頜繵繣縇饋饘綪
豅,豅襱舗谾龓徿舖谼谻雒
豆,豆夏亘壴复戛疐重宴戞
豇,豇玒剅虹叿鼿肛亄訌郖
豈,豈荳貴荁量旹苣黃置暈
豉,豉馶敱鼔跂鼓敼菆玻薂
豊,豊琧壹薑蛗霅晝譻罿瞾
豋,豋詧登簦眢鲨昚笞筨餈
豌,豌琬踠晼睕腕玩啘黦畹
豍,豍琕聛珅蜱亸睥嚲髀豏
豎,豎賢蜸腎譥硻轚鼞掔鳘
豏,豏螊辣駷疎踈跊瑓膁竦
豐,豐舋疂璺蘴罿罯寷峕豊
豑,豑豒軿珶誁説銻蛢皝餅
豒,豒豑説銻餅誁皝绨珶艷
豓,豓豔监豁盢濌躻醓鎔盗
豔,豔豓灩饁竖监醘龞坐虌
豕,豕豖冢彳乑琢家涿象枩
豖,豖豕冢琢豩涿家藜乑诼
豗,豗廫疁飂醪膠醦幓磣蟉
豘,豘豧狆豜豴豝甤豣独豠
豙,豙家冡象彖蒙冢亥袤荄
豚,豚硺肧啄椓琢诼諑腏脉
豛,豛毅殁殺豭役敥豮效毇
豜,豜豣豻豱犴貎豠豘豲狆
豝,豝犯豱豠狃把豘狂祀狛
豞,豞豿狗狥夠貐袧犳豹剢
豟,豟砨豲猏犵狔獂痆軶阸
豠,豠豱狙狂狃豝爼莥豴峱
象,象彖豙冡家蒙冢蒃篆累
豢,豢絭萘桊袠荄蓘茭萦亥
豣,豣豜豱豻豲貎豠犴礽豘
豤,豤貇狠豭狼很艰裉豲猥
豥,豥孩姟絯豩赅硋豯狡核
豦,豦緳扅嚎痎濠康彦层矇
豧,豧貓豴豘狜貊貚犻貛貀
豨,豨狶稀希絺浠桸黐豬琋
豩,豩涿豥诼豖椓烼硺琢豕
豪,豪蒙裛霥蒃冡录裊繤暴
豫,豫鐌橡掾襐猭潒像瑑椽
豬,豬猪豴藸蕏貉豧狢豨潴
豭,豭貑豤猳玁狠婽豛獨豠
豮,豮豶貘获藐貌颏貓豛貇
豯,豯貕縘徯豀豥騱猤榽磎
豰,豰縠穀榖毇糓毂毅殼轂
豱,豱豠狂豝狃莥峱狌豜豣
豲,豲獂豤豣豜豟猓縓嫄豭
豳,豳幽凼囪囮函氹圝隧豾
豴,豴豧豠豬豘殢貓蕕狧猟
豵,豵瑽摐漎縱磫鏦樅傱從
豶,豶蕦獖豮獚獱貘窄覆殨
豷,豷狺猜殪猖猬獲獦殭貗
豸,豸參爹鬖翏参乥戔豕蔘
豹,豹豿貂豺犳貈豾貊剢豽
豺,豺犲豹勠勨豽豿貀剢芴
豻,豻犴貒貈貎狂貊貌豜貀
豼,豼貀犼貌紕批貔貎貅犰
豽,豽貁貅貀貑豾豺貊貇貓
豾,豾狉貂豽豹貅貀貁豿貔
豿,豿豞豹貐狗貈狥犳貏貌
貀,貀貊貓豼貒貌貎貈貍豻
貁,貁狖豽貅犺貌貈狇豿貇
貂,貂貊貃貉豹貍貓貀貈豾
貃,貃狛貊貂貓貆貈貚貛貉
貄,貄貚貛貋貍貏貘狤貗貓
貅,貅狇狝貁豽猍狱犾狄貑
貆,貆貙貍狟狚薶貊貗貚貓
貇,貇豤狠貑狼貔貎狽猥很
貈,貈貌貎豻貒貀貓豿貊貔
貉,貉狢貂貖餎貃臵豬獈豹
貊,貊貓貂貃貀貍貆豻貙貛
貋,貋猂貚貄狎貍貙狷貏猖
貌,貌貎貈貏貀貔猊豻狆貍
貍,貍貆貙貊貛貎貄狸狚貔
貎,貎貌猊貈貍豻貀貔犰貏
貏,貏貚貌猈貄貘貔貎貋貈
貐,貐豿狥猞狗貓猗貈豞獊
貑,貑豭貇猳貔狠貒獨貙豽
貒,貒猯豻貓貈貀犴貑貊貌
貓,貓貊狜豧貀貃貛貒猫貈
貔,貔貑貌貍貎貏貇貈貛豼
貕,貕豯豀貘縘猤貔徯貗毿
貖,貖獈貒縊貓貉谥缢貂搤
貗,貗貜貚貆貘獞獖貛貄獌
貘,貘獏貏貚貗猉貄獖獚貕
貙,貙狪貆猩猖狚狙貍猵猬
貚,貚貄貏貋貘貗貛貍貊貆
貛,貛貄貓獕貍獾貚貊貙貗
貜,貜玃貗貛貄獌獲矡貋貚
貝,貝冥具頁县買昗員景裊
貞,貞貢頁真買寘寊蒖窴賞
貟,貟貪貧畣貵盒窴弇拿覔
負,負篔筫貞簤貟賞貫夐賃
財,財财賅眑聈勳对肘时賜
貢,貢頁賁蒖賈貞責寘蓂買
貣,貣賫貪寶窴鸢貟斍鬒夤
貤,貤肔吔驰馳毑地虵咃弛
貥,貥肮貦航蚢魧骯盺妔吭
貦,貦盶朊貥魭酛貺蚖馸肮
貧,貧貟貪貵賚蚠資覔賌賫
貨,貨貸貲覮賫货筫負賃賞
販,販畈皈眅昄贩魬舨版坂
貪,貪貟貵貧畣盒窴貣倉覔
貫,貫貰實蒷員貴買蕢賞霣
責,責貴賈蕡蕒費賁賣藚賨
貭,貭屓廔厧屢廈盾債瘨扈
貮,貮貳弌弍弎戴贰載弐酨
貯,貯賩眝聍賗貹咛貥賆羜
貰,貰貫蒷黃賁寊貴蒖蕒萯
貱,貱駊骳跛肢鞁玻馶啵皈
貲,貲眥歶訾貨鬒鴜觜寶賫
貳,貳貮弎贰弍弌甙戴載試
貴,貴責實黃置量賷蕢費宣
貵,貵軬貪奙賚貧奆貟賫鮝
貶,貶眨贬賅砭賤賎受姂戝
買,買頁實寘貢寅貫貞寛寊
貸,貸貨貪貟贷賃貧貣資貲
貹,貹貼胜賘賍貯鮏貺贚姓
貺,貺眖贶聣貦眀軦既明覥
費,費賷寶賫賈賨責蕡賁蕒
貼,貼賗貹購贚聃賄賭胋鼆
貽,貽贻眙駘骀胎賶跆鮐齝
貾,貾眡胝呧弤眂蚳軧觝骶
貿,貿寳贀覺寶賀賫賌資賛
賀,賀費賷萯賛驾疍買貿貴
賁,賁賈蕡貢蕒寶責賣費霣
賂,賂駱鴼略眳赂胳骆觡鮥
賃,賃鵀賲貸質篔負赁簤貨
賄,賄贿貼賗賻贎賱貽鮪賰
賅,賅胲畡駭赅骸晐骇輆賋
賆,賆駢聠骿胼駾軿跰骈騈
資,資賚賌貧賫貵覔贊貿貪
賈,賈賁蕒賣蕡責寶費藚貢
賉,賉殈舢咖桖貤烅甽珈盯
賊,賊駥贼賳駴城聝驖黬賦
賋,賋骹駮咬皎較蛟晈跤胶
賌,賌賚賫資畜巹貵覔寳貧
賍,賍賘脏赃駐聇賉贓貹貥
賎,賎践賤贱残戝饯踐聀牋
賏,賏賟瞑顛顚珼賱與唄賯
賐,賐畯睃踆駿晙鵔鮻朘脧
賑,賑脤赈賬娠蜄辴脈販眽
賒,賒賖赊駼畭鵌艅鮽脍蜍
賓,賓薲寶賨寊費賌質萯責
賔,賔屓宧匵虘屢厧亶葿廩
賕,賕脙赇鯄殏蛷眿球觩脉
賖,賖賒畭駼艅鵌鮽赊硢蜍
賗,賗賱貼聛購聃眒呷盽贚
賘,賘賍脏赃聇貹胜賉眐贓
賙,賙皗睭赒眮騆晭胛聑瞯
賚,賚賌資貵覔查賫貧贅貪
賛,賛贊贅薋贄萯寳費賨輦
賜,賜赐睗晹啰畼踼蜴踢舓
賝,賝琛跺駯跥跦槑镻哚騍
賞,賞貫蒖蕒貞實賁寘貰覚
賟,賟睓琠晪唺腆賏鱮踑骐
賠,賠贈購踣赔醅瞎鞛暗賭
賡,賡屪赓麖賔屓羼癢屢屬
賢,賢腎豎蜸贒掔鄨贅贄肇
賣,賣賈蕒蕡藚責賁壹賨蕈
賤,賤賎踐輚醆琖殘贱牋飂
賥,賥睟啐晬脺蜶琗踤崪埣
賦,賦珷赋聝賳軾碔貾骶黬
賧,賧睒醈晱腅啖赕舕餤琰
賨,賨費蕡賮責賣蕒賈實寶
賩,賩騌貯腙踪骔鯮晾鰁騡
質,質寊寶貢貫賁霣買蒷賈
賫,賫費寶賈賁賷責蕡蕒窴
賬,賬賑脹駺躼脤韔眼張帳
賭,賭睹暏赌醏賰啫購賂貽
賮,賮蕡蕢賨畫蔶藚蕒責賣
賯,賯賱贉賏賗聑賵煦贘瞑
賰,賰踳睶贐暙賭鰆購瑃蹖
賱,賱贉賗購腪賯皹賵賻暉
賲,賲賃資賛貸贊賀鵀賚貧
賳,賳睵職驖膱戰蟙騀賦軄
賴,賴頼頛顆頰頬穎頳顂頴
賵,賵睊赗贉瑁晿艒唱睸賱
賶,賶蹌艙瑲嗆嵢貽牄眙螥
賷,賷費賈賁寶貴賫置蕡蕢
賸,賸膹鰧臔膭黱謄臢臗膡
賹,賹膉艗螠齸嗌隘镒賂榏
賺,賺赚賗嫌膁嗛曗賆螊贌
賻,賻赙賱贎賗髆膊購暷賄
購,購賱贚賗贉賠賰賭贘啨
賽,賽謇費養骞弿賷竇賨霉
賾,賾皟瞔靧瞶磧嘖蹟嗊碽
賿,賿疁蹘蟉膠髎嘐贂磟轇
贀,贀瞖贅贒鹥寳鷖寶貿賛
贁,贁散敳敯數敔敗敫啟斁
贂,贂黲驂賿黪醦鯵骖鰺嘇
贃,贃瞣嗯患噁愳聰騦驄睱
贄,贄寳賛贅蟄贒鹫謺暬鸷
贅,贅賛贀瞀鰵贄聱鳘鰲鳌
贆,贆駖瞭昤镽畷賒驗賧賋
贇,贇赟贙贄贊薋瞀旮骛叴
贈,贈驓賠鱛噌赠贍蹭賭體
贉,贉瞫賱賵曋嘾贘驔購賯
贊,贊賛寳薋贄贙資賌贅萯
贋,贋鷹贗譍鹰黂膺屓廣貭
贌,贌瞨驜驥蹼轐贚贘騏璞
贍,贍聸瞻曕黵膽赡噡韂舚
贎,贎賻贖購贘瞗賗賄聤賰
贏,贏驘鸁蠃羸臝嬴赢蝱畐
贐,贐賰嚍購贉矐贖賱璶囆
贑,贑蘏顫巔韥顛顥顐頴顎
贒,贒賢贄贀寳寶覽暨費賫
贓,贓贜駴黬駥畖墄颿呱晠
贔,贔瞐圼呈聶皨晶皛鼂嘦
贕,贕赗頨順赡赠頫煝懭贮
贖,贖贘賾嘖嗊瞔皟蹟瞶寢
贗,贗贋屓膤愪鹰朣膭膧囆
贘,贘贖膹贉瞶曊聵購賾嗩
贙,贙贊贄賛贇贒晳皙鹫寳
贚,贚購賗躘貼贌騅朧瓏眭
贛,贛赣贑戇謠竷爭誵蓔讂
贜,贜贓臟駴駥黬驖賳臓賦
贝,贝见几凤屼恻风呗叽凡
贞,贞页苋负顷贡荧贠览贲
负,负贠贞奂页觅奐笕免烉
贠,贠贪炱负贫僉貟枲矣洜
贡,贡责贲黄贳贾贯页竞赏
财,财財叼赐赇贶则网购勑
责,责贡贲贵贾赏責竞黄贳
贤,贤赍赀賢熒紧贸竖肾贯
败,败敗贩敟政敃敕赦购赕
账,账胀帐怅赕张咪贱赈眯
货,货贷赁赀貨貸贪贫筼资
质,质屃貭兏庼原康盾庚庾
贩,贩畈岅舨販皈饭败昄阪
贪,贪贫贠食侌资貪弇衾僉
贫,贫贪资贠貧炃蚠炱貪贷
贬,贬貶眨赅贱姂砭飂瓞抸
购,购贿败灼婀飑财则哅瓝
贮,贮赠赡赔赙赗尫虺贕赎
贯,贯贲贳贵贡员责赏煑頁
贰,贰貳貮甙弎忒弌弍胾戴
贱,贱賎践戏戝残贬聀赅饯
贲,贲责贡贯赏贵贾贳頁買
贳,贳贲赏贯贵责贡貰员黃
贴,贴则州帅赃贿艸囎帖赒
贵,贵贲责贯贳黃蒉贡员景
贶,贶貺赒觍婗呖岲貦明姗
贷,贷货貸赁赀贪资袋帒貨
贸,贸资贽貿贺寳留贊贲赍
费,费赉责赛贵赍贲贡贾羐
贺,贺贲賀赍贵贸贯费赀赁
贻,贻貽胎殆跆赌赊炲骀始
贼,贼賊娀喊喴娍隇嗽峸嘁
贽,贽蛰贸赞资势赘贯赉赟
贾,贾贲责贡雵賈蘭赏霙賣
贿,贿賄购赙赒贻贴赗赠卼
赀,赀货貲贷贲胔赍飺鮆貨
赁,赁货贷賃凭貸赀貨賲贲
赂,赂賂衉略赌峈胳蛒烙路
赃,赃賍脏賘嗁喱贴踮赈帅
资,资贫資贪贸瓷姿餈贷贽
赅,赅畡姟峐晐胲骇賅咳烗
赆,赆烬侭瓞赎咫飕贶赐飓
赇,赇殏賕贼蛷婡球赅崍财
赈,赈賑娠脤帪蜄陙贩嗁脈
赉,赉费赍赛飬类赘秀葵萒
赊,赊賒賖畭蜍脍艅贻硢馀
赋,赋賦娬贼碔凪斌凧陚嚈
赌,赌帾啫賭媎赂贻暏蝫赗
赍,赍赉费贵齌赀贲贤责贺
赎,赎赙娸赅贼贮婰賟败嬩
赏,赏贲贳责覚贡贯賞黄貞
赐,赐賜晹睗踢焬婸畼蜴啰
赑,赑劦簽刕眾灥薟苶齢聚
赒,赒啁賙赗贶晭哃嫺婀喎
赓,赓賡屪麖賔廙凑康廔廩
赔,赔赠赡賠贮赗婄踣赂赌
赕,赕啖婒腅賧睒晱醈燚惔
赖,赖颇颊颗濑锁颖欶賴颅
赗,赗賵贕赒媚煝艒煟蝞媢
赘,赘獒螯嫯螫骜蝥婺鳌聱
赙,赙賻贿煿赎贮嶟虺嫥牔
赚,赚嗛嫌嵰膁賺螊熑妺慊
赛,赛寨奏褰秦蓁赉莠费寋
赜,赜瞆啧唝瞚聩頤喷碛賾
赝,赝贋鹰膺噟质廎贗臗鷹
赞,赞贽赟赘僰贊赏赉贸籫
赟,赟贇赞贽婪饗棼赘螫蟄
赠,赠赔噌嶒囎贮赡贈蹭噹
赡,赡贍噡幨赔聸嶦膽蟾贮
赢,赢嬴贏羸蠃鸁驘臝朚蝱
赣,赣贛謠讃讂竷謱讀叢讚
赤,赤朩办木苏尢亦尤术本
赥,赥缼欣杴欫欳欪肷扻苁
赦,赦敕攽放敖敇救敌敬敚
赧,赧赮搬棴叝报齦報罛喌
赨,赨粬粙柚杣籼秙桖秈枾
赩,赩艴艵栬艳尯兘桷脃桅
赪,赪桢颅帧颃颀敊顽颛频
赫,赫懗楙赪杮麻捇嚇劥憱
赬,赬頳楨頪頏赪頼幀頄粸
赭,赭楮帾槠媎赌栲储楉暏
赮,赮赧嘏搬棴櫉椵欕碬懨
赯,赯搪榶糖檘櫨塘慵槦櫔
走,走歨定萣媢娼娟疋疌鳺
赱,赱芝羑芰麦羐叏穵乏艺
赲,赲勊趀攰趔赸越趣赾趚
赳,赳剋赸趔尅趐訆趉魁劏
赴,赴卦卧齜龪趣訃龇趉乱
赵,赵龪越趑赿魕赼魆沊趒
赶,赶趀赴赾进兛趚軖趣趏
起,起趄趗靼趉赸趘尪趟趈
赸,赸趉趈辿赳剋軕赲趄趟
赹,赹趨趲昀趦枃趡趱趍趇
赺,赺龄趝趛鹷砛皊竛砱軡
赻,赻尟越逤麨竗趣抄渺趁
赼,赼趂趑趃趎赽趓欯龪欪
赽,赽趃趚龪赼枎越缺趓趑
赾,赾鬿龂齗斮趀断靳斯赲
赿,赿趆龪越赵趑趃趣趎迅
趀,趀趎赲趚赾趔攰赶赿趓
趁,趁駗轸診軫跈聄畛眕珍
趂,趂赼趎趑趜妳趓欯趀歒
趃,趃赽趓趚赼趑龪趎赿越
趄,趄起趈超靼兡赸旭趉趗
超,超趄趦趋兡趏趫趥趙尷
趆,趆赿軧龪赵羝牴柢趩趎
趇,趇越赸砬柆垃赹趏拉趡
趈,趈趌趄趞趉趥赸趟趠兡
趉,趉赸靾齛趈趟怈吐壯枻
越,越魆樾龪赿趣赵赻趑赲
趋,趋趥趙超趞兘趲趟艴赩
趌,趌趞趈趤趠趪趥趡趟趙
趍,趍趁迻遪槮恀拸栘椮毶
趎,趎趀趂赼趓趑趒趢魅龪
趏,趏趞趄趟趫趌尰超媑兡
趐,趐翅趨趣翹翘趔趜趰赳
趑,趑赼赵龪趃趂趎趒越赿
趒,趒逃桃烑趎鞉趑龪恌毩
趓,趓趃尮趎趮赼趚赽趑趢
趔,趔迾赲趐趀赳赸龪攰栵
趕,趕趠趘趧韹韙趌桯媓橿
趖,趖挫趱睉唑趡矬趲趦樦
趗,趗趧趘起趄趩魓超趕赲
趘,趘趗趧趕趩趠起兣遲趯
趙,趙趟趞趋魈趌趈兡趄趥
趚,趚趀趮趃赽趓趎尲赲魐
趛,趛趝趡惍赺烇崯栓唫检
趜,趜毱趎趂趐趢趰趔趨趀
趝,趝趛旕趁赺鯰焾踗騐棯
趞,趞趌趈趪趙趥趋趏趟趠
趟,趟趙趉趈趌趄趞赸趏魈
趠,趠趕趌趈兣趞韑韙趘趄
趡,趡魋趛趌雔趖趫连雉雃
趢,趢趎邃逯趓趜趮娽椂鵦
趣,趣越趐樾赿赴赲赻趰赵
趤,趤趌榁楦趞趠煊諠莲懛
趥,趥趲趋趈趞趌轊趟遒趖
趦,趦超趖趲楂烃趥烙煃楏
趧,趧趗趘趕遈睲鞮瑆謃睼
趨,趨趐赹趜煼趍超齺趰趄
趩,趩趘題趗趮趬摆趆選熼
趪,趪趞趌黋尵遗燑擡趥趈
趫,趫趡趏超趛趦赶兡矯趈
趬,趬趮遶趩廛趠趤癦趚莲
趭,趭趡趚赶进梽趬趠誌趃
趮,趮趚趓趬尲棵赽梀趃趢
趯,趯糶擢曜趲矅櫂趖欔嚁
趰,趰邇趣趐趜彌趝檷遯趨
趱,趱趖趲魕越趒趓毯趃赹
趲,趲趥欑趖趱趋趯趡趦躦
足,足是兄星寔昰建显萣定
趴,趴玐臥閄耿叭馱瓤爴踿
趵,趵馰肑玓虳跗酌跔政靮
趶,趶跱玗旴盱弙趼盰骬吁
趷,趷盵肐吃阣矻釳圪籺扢
趸,趸疐疌寁萐葦鼋躠亘重
趹,趹趺跌胦駃缺駚映胅畉
趺,趺跌趹跃肤胅畉跦玞镻
趻,趻跉肣玪昑耹吟霒玲軡
趼,趼跣踞肼跰趶跀硏跚嚻
趽,趽昉跰坊踠肪琷蚄防踌
趾,趾耻跐胐朏踫骴跇昢肚
趿,趿跛昅馺吸砐躈蹶钑岋
跀,跀玥跼趼朙踻朋明踞朗
跁,跁肥巸跙踻鲃弝吧舥靶
跂,跂馶豉歧跋跛毀肢跩吱
跃,跃趺镺趹饫跌跞踝踩矨
